"id","Address","Response_Address","Response_X","Response_y"
7284,"桃園市觀音區樹林里工業一路9號",NA,NA,NA
7285,"桃園市桃園區中山里桃德路１１３巷３７之１號",NA,NA,NA
7286,"桃園市蘆竹區坑口里１５鄰頭前２８－４號",NA,NA,NA
7287,"桃園市桃園區忠義里成功路三段115巷86號（1樓）",NA,NA,NA
7288,"桃園市蘆竹區錦中里南崁路１段２３１巷５１號",NA,NA,NA
7289,"桃園市桃園區忠義里成功路３段１１５巷８０號",NA,NA,NA
7290,"桃園市龜山區南上里南上路290巷42弄2號",NA,NA,NA
7291,"桃園市蘆竹區錦興里錦華路４０號１樓",NA,NA,NA
7292,"桃園市蘆竹區蘆竹里８鄰富國路３段１１８６號",NA,NA,NA
7293,"桃園市新屋區九斗里上青埔５８之５號",NA,NA,NA
7294,"桃園市平鎮區雙連里民族路雙連二段一一八巷五三弄四二號",NA,NA,NA
7295,"桃園市龜山區南上里民生北路一段二巷二弄一號",NA,NA,NA
7296,"桃園市八德區白鷺里廣福路八七九巷一七二號",NA,NA,NA
7297,"桃園市龜山區龍壽里東萬壽路六四六號",NA,NA,NA
7298,"桃園市蘆竹區長興里長安路一段一六０巷一０號",NA,NA,NA
7299,"桃園市蘆竹區內厝里長安路二段39巷5號",NA,NA,NA
7300,"桃園市蘆竹區瓦窯里南山路１段３４９巷２０號１樓",NA,NA,NA
7301,"桃園市平鎮區建安里平東路一段一七八巷十七號",NA,NA,NA
7302,"桃園市八德區茄苳里寶豐街一五巷一二號",NA,NA,NA
7303,"桃園市蘆竹區山鼻里南山路三段一七巷一五號",NA,NA,NA
7304,"桃園市八德區大發里和成路三０號",NA,NA,NA
7305,"桃園市蘆竹區五福里六福路五號",NA,NA,NA
7306,"桃園市蘆竹區新莊里大興路２０巷１９弄９號",NA,NA,NA
7307,"桃園市龍潭區凌雲里聖亭路一三五號一樓",NA,NA,NA
7308,"桃園市平鎮區建安里平東路一段一七八巷三０號",NA,NA,NA
7309,"桃園市新屋區社子里一鄰社子一之三八號",NA,NA,NA
7310,"桃園市龜山區龍壽里東萬壽路六四二巷九五號",NA,NA,NA
7311,"桃園市龜山區龍壽里龍校街一二一巷四弄一四號一樓",NA,NA,NA
7312,"桃園市楊梅區水美里楊湖路一段一九四巷三號二樓",NA,NA,NA
7313,"桃園市平鎮區金星里中豐路南勢二段四六０巷一三三號",NA,NA,NA
7314,"桃園市中壢區龍德里東園二路一０號",NA,NA,NA
7315,"桃園市桃園區大林里大誠路八之一號",NA,NA,NA
7316,"桃園市蘆竹區內厝里長安路一段一六０巷一號",NA,NA,NA
7317,"桃園市新屋區永安里18鄰聚賢路355號1樓",NA,NA,NA
7318,"桃園市龜山區兔坑里海萍路一六巷八之一號",NA,NA,NA
7319,"桃園市龜山區幸福里華亞三路五０號四樓及六樓之二",NA,NA,NA
7320,"桃園市蘆竹區新興里文中路一段一六號",NA,NA,NA
7321,"桃園市平鎮區湧光里工業十一路一號",NA,NA,NA
7322,"桃園市平鎮區建安里平東路六七九巷一七號",NA,NA,NA
7323,"桃園市八德區茄苳里開隆街４８號",NA,NA,NA
7324,"桃園市中壢區東園路18號",NA,NA,NA
7325,"桃園市桃園區汴洲里莊敬路一段七八號",NA,NA,NA
7326,"桃園市平鎮區建安里平東路六五九巷三三號",NA,NA,NA
7327,"桃園市龜山區文化里華亞五路116巷8號",NA,NA,NA
7328,"桃園市中壢區忠福里中壢工業區南園路一號",NA,NA,NA
7329,"桃園市龜山區大華里２７鄰頂湖三街１１號及１３號",NA,NA,NA
7330,"桃園市桃園區建國里建國東路２３、２５號",NA,NA,NA
7331,"桃園市蘆竹區蘆竹里蘆竹街１９５號",NA,NA,NA
7332,"桃園市楊梅區梅溪里新農街二段209巷61弄30號",NA,NA,NA
7333,"桃園市中壢區內定里內定二十街15巷18號",NA,NA,NA
7334,"桃園市大園區內海里民權路９－２號２樓",NA,NA,NA
7335,"桃園市楊梅區瑞原里楊新路三段357巷40號",NA,NA,NA
7336,"桃園市大園區內海里民權路９－２號１樓",NA,NA,NA
7337,"桃園市桃園區汴洲里?務路二二巷二號",NA,NA,NA
7338,"桃園市龍潭區烏林里工五路１３９巷１１６弄５０號",NA,NA,NA
7339,"桃園市龜山區南美里南上路326號",NA,NA,NA
7340,"桃園市龜山區南美里２２鄰南美街１２６巷１２號",NA,NA,NA
7341,"桃園市平鎮區湧安里工業十二路５號",NA,NA,NA
7342,"桃園市蘆竹區內厝里長興路三段１２５號",NA,NA,NA
7343,"桃園市中壢區永福里中園路１９８號３樓",NA,NA,NA
7344,"桃園市大園區內海里8鄰民生路106-3號",NA,NA,NA
7345,"桃園市龜山區文化里科技一路３２號",NA,NA,NA
7346,"桃園市觀音區廣福里１５鄰１７０號",NA,NA,NA
7347,"桃園市楊梅區高山里高獅路八六三巷一一號",NA,NA,NA
7348,"桃園市龜山區大坑里南上路392號",NA,NA,NA
7349,"桃園市中壢區中華路一段八三八號",NA,NA,NA
7350,"桃園市大溪區仁和里埔頂路１段２５７之１、２５７之２號",NA,NA,NA
7351,"桃園市楊梅區大平里新江路１００號",NA,NA,NA
7352,"桃園市龜山區楓樹里自強北路17巷31號2.3樓",NA,NA,NA
7353,"桃園市大溪區瑞興里瑞安路１段２號",NA,NA,NA
7354,"桃園市龍潭區烏林里工五路191巷67弄17、21號",NA,NA,NA
7355,"桃園市楊梅區水美里楊新路２段１５８號",NA,NA,NA
7356,"桃園市平鎮區平南里中豐路南勢二段４６０巷１１６之６號",NA,NA,NA
7357,"桃園市八德區大安里榮興路３９之１號",NA,NA,NA
7358,"桃園市中壢區忠義里中華路一段８３５巷２６、２８號",NA,NA,NA
7359,"桃園市中壢區後寮里中山東路二段４２２巷６５號",NA,NA,NA
7360,"桃園市蘆竹區坑口里三德街55號",NA,NA,NA
7361,"桃園市桃園區大林里興邦路４５－１號１樓、２樓",NA,NA,NA
7362,"桃園市龜山區大華里頂湖七街３號",NA,NA,NA
7363,"桃園市蘆竹區內厝里南山路２段３５７巷３８－３號１樓",NA,NA,NA
7364,"桃園市八德區大華里介壽路２段４１１號",NA,NA,NA
7365,"桃園市中壢區內定里內定二十街１５巷２６號",NA,NA,NA
7366,"桃園市蘆竹區新興里中興二街13號",NA,NA,NA
7367,"桃園市大溪區一德里康莊路六九七號",NA,NA,NA
7368,"桃園市龜山區大崗里頂湖二街６２號",NA,NA,NA
7369,"桃園市龜山區兔坑里茶專一街６８號１樓",NA,NA,NA
7370,"桃園市龍潭區烏林里工五路２１４號１、２樓",NA,NA,NA
7371,"桃園市新屋區望間里１３鄰１５間１３之２、１３之６號",NA,NA,NA
7372,"桃園市觀音區大潭里環南路７２３號",NA,NA,NA
7373,"桃園市龜山區嶺頂里振興路５４號１樓",NA,NA,NA
7374,"桃園市龜山區大華里頂湖七街７號地下一層",NA,NA,NA
7375,"桃園市觀音區新坡里中山路二段61號",NA,NA,NA
7376,"桃園市龍潭區烏林里烏林里工二路一五一號",NA,NA,NA
7377,"桃園市八德區福興里３鄰廣興路３１６巷１１號",NA,NA,NA
7378,"桃園市觀音區草漯里榮工北路１３之１號",NA,NA,NA
7379,"桃園市龜山區大華里寶石街６０巷１２之１號３樓",NA,NA,NA
7380,"桃園市龜山區新嶺里萬壽路１段４２２巷２７弄３０號",NA,NA,NA
7381,"桃園市觀音區樹林里經建一路３２號",NA,NA,NA
7382,"桃園市龜山區兔坑里４鄰茶專一街１１２巷２１、２３號",NA,NA,NA
7383,"桃園市中壢區內定里內定二十街１５８巷３２號",NA,NA,NA
7384,"桃園市觀音區樹林里工業二路６之１號",NA,NA,NA
7385,"桃園市龜山區樂善里文明路七○號",NA,NA,NA
7386,"桃園市龜山區大崗里頂湖二街48號",NA,NA,NA
7387,"桃園市中壢區龍德里東園路七九號四樓",NA,NA,NA
7388,"桃園市龍潭區烏林里工五路139巷116弄36號1.2樓",NA,NA,NA
7389,"桃園市新屋區社子里中興路６０７號２樓",NA,NA,NA
7390,"桃園市楊梅區高榮里民族路五段一四七巷一○弄三五號一樓",NA,NA,NA
7391,"桃園市龍潭區三和里朝鳳路一號",NA,NA,NA
7392,"桃園市中壢區普仁里普忠路二一一巷八弄五衖五號",NA,NA,NA
7393,"桃園市中壢區忠義里２鄰南園路２－５號",NA,NA,NA
7394,"桃園市新屋區九斗里九斗７－５號",NA,NA,NA
7395,"桃園市平鎮區龍恩里游泳路懷恩巷２５號１樓",NA,NA,NA
7396,"桃園市桃園區汴洲里春日路１４３４巷１５０號",NA,NA,NA
7397,"桃園市新屋區東明里東勢一二之九號",NA,NA,NA
7398,"桃園市桃園區大林里大原路１８之８號",NA,NA,NA
7399,"桃園市中壢區永福里西園路93號",NA,NA,NA
7400,"桃園市蘆竹區新興里中興路92號1樓",NA,NA,NA
7401,"桃園市桃園區大林里興邦路32號1、2、3樓",NA,NA,NA
7402,"桃園市蘆竹區海湖里海山東街41號(1樓)",NA,NA,NA
7403,"桃園市蘆竹區蘆竹里南崁路二段419巷22弄11號（1樓）",NA,NA,NA
7404,"桃園市蘆竹區長興里南崁路二段228巷273弄32號及38號",NA,NA,NA
7405,"桃園市八德區大華里介壽路二段三○九號一樓",NA,NA,NA
7406,"桃園市平鎮區南勢里南東路50巷2號",NA,NA,NA
7407,"桃園市蘆竹區新莊里14鄰新庄子58-7號1樓",NA,NA,NA
7408,"桃園市平鎮區新安里太平東路7號",NA,NA,NA
7409,"桃園市中壢區過嶺里福祥路390巷2、6、8、10、12號",NA,NA,NA
7410,"桃園市八德區高明里高城路二○一之二號",NA,NA,NA
7411,"桃園市桃園區汴洲里幸福路85巷17、19、21號",NA,NA,NA
7412,"桃園市中壢區後寮里龍興路717巷8號1樓",NA,NA,NA
7413,"桃園市八德區茄苳里永豐路二二六巷六八弄三○號一樓",NA,NA,NA
7414,"桃園市龜山區樂善里文明路６４號",NA,NA,NA
7415,"桃園市桃園區中山里中山路９５６巷７１號",NA,NA,NA
7416,"桃園市龍潭區高平里高楊南路334號",NA,NA,NA
7417,"桃園市觀音區樹林里國建一路六號",NA,NA,NA
7418,"桃園市蘆竹區蘆竹里南崁路二段四二一巷六、八、一０號",NA,NA,NA
7419,"桃園市大溪區福安里15鄰復興路一段218巷198號",NA,NA,NA
7420,"桃園市蘆竹區長興里興隆街40巷23號",NA,NA,NA
7421,"桃園市蘆竹區長興里興隆街31號",NA,NA,NA
7422,"桃園市中壢區中正里榮民路四二一號",NA,NA,NA
7423,"桃園市桃園區龍山里龍壽街300之4號1樓",NA,NA,NA
7424,"桃園市楊梅區富岡里三五鄰富聯路一九八巷八號",NA,NA,NA
7425,"桃園市蘆竹區中福里龍壽街一段73號之2",NA,NA,NA
7426,"桃園市八德區瑞豐里興豐路448號",NA,NA,NA
7427,"桃園市桃園區玉山里玉山街一五四號",NA,NA,NA
7428,"桃園市桃園區汴洲里鹽庫街六二號",NA,NA,NA
7429,"桃園市蘆竹區瓦窯里南山路一段三四九巷二三號",NA,NA,NA
7430,"桃園市蘆竹區山腳里橋頭街160號(1樓)",NA,NA,NA
7431,"桃園市蘆竹區坑口里大有街１２號１樓",NA,NA,NA
7432,"桃園市龍潭區高平里高楊南路320巷1號",NA,NA,NA
7433,"桃園市桃園區建國里林森路六八巷二九號",NA,NA,NA
7434,"桃園市桃園區汴洲里春日路1434巷88號",NA,NA,NA
7435,"桃園市八德區大竹里榮興路27號1.3樓",NA,NA,NA
7436,"桃園市楊梅區瑞坪里蘋果路9號",NA,NA,NA
7437,"桃園市八德區大愛里和平路２７６巷６６號",NA,NA,NA
7438,"桃園市八德區瑞泰里瑞源一街３８號",NA,NA,NA
7439,"桃園市楊梅區永平里新農街二段209巷62弄47號",NA,NA,NA
7440,"桃園市大園區埔心里20鄰埔心87-3號",NA,NA,NA
7441,"桃園市龍潭區高原里高原路367巷189弄7號",NA,NA,NA
7442,"桃園市大溪區瑞興里８鄰大鶯路９９７號",NA,NA,NA
7443,"桃園市平鎮區平南里40鄰中豐路南勢二段460巷118-8號",NA,NA,NA
7444,"桃園市蘆竹區坑口里7鄰後壁厝88-15.-16號",NA,NA,NA
7445,"桃園市八德區大竹里榮興路71號",NA,NA,NA
7446,"桃園市蘆竹區長興里南崁路2段228巷266弄19號",NA,NA,NA
7447,"桃園市蘆竹區五福里五福一路32巷17號1樓",NA,NA,NA
7448,"桃園市龜山區南上里民生北路一段572號3樓",NA,NA,NA
7449,"桃園市龜山區山頂里興邦路31-2號",NA,NA,NA
7450,"桃園市八德區大湳里和平路７０４巷１５號",NA,NA,NA
7451,"桃園市平鎮區南勢里5鄰南東路230號",NA,NA,NA
7452,"桃園市大溪區瑞興里大鶯路755號(1樓)",NA,NA,NA
7453,"桃園市楊梅區高上里2鄰幼三路6號1、2、4樓",NA,NA,NA
7454,"桃園市龜山區山頂里山鶯路171-1、171-5號",NA,NA,NA
7455,"桃園市大園區南港里9鄰許厝港6號",NA,NA,NA
7456,"桃園市平鎮區金星里金星里中豐路南勢二段四六○巷一○一及之一號",NA,NA,NA
7457,"桃園市八德區瑞興里介壽路二段２５２巷７１弄６９號１、２樓",NA,NA,NA
7458,"桃園市中壢區文化里合江二路６－１號",NA,NA,NA
7459,"桃園市中壢區內厝段1568地號",NA,NA,NA
7460,"桃園市楊梅區三湖里楊湖路１段６７６巷３３弄７４號",NA,NA,NA
7461,"桃園市楊梅區永平里３鄰梅獅路１段１７１號",NA,NA,NA
7462,"桃園市楊梅區高山里高獅路８１３巷２０號",NA,NA,NA
7463,"桃園市龜山區大華里頂湖路7-1號2樓",NA,NA,NA
7464,"桃園市蘆竹區錦興里錦秀街16號1、2樓",NA,NA,NA
7465,"桃園市龜山區福源里7鄰海萍路7號、7號3樓",NA,NA,NA
7466,"桃園市平鎮區鎮興里興隆路２號",NA,NA,NA
7467,"桃園市楊梅區秀才里新江路１５５巷７３號",NA,NA,NA
7468,"桃園市新屋區永興里大牛欄8-10號",NA,NA,NA
7469,"桃園市龜山區山頂里山鶯路３４０巷２號",NA,NA,NA
7470,"桃園市中壢區高邊路八號",NA,NA,NA
7471,"桃園市蘆竹區大興路20巷19弄11號",NA,NA,NA
7472,"桃園市觀音區樹林里工業八路1號",NA,NA,NA
7473,"桃園市蘆竹區長興里南崁路二段9號4樓之12",NA,NA,NA
7474,"桃園市龜山區龍壽里龍校街一一九巷八號一樓",NA,NA,NA
7475,"桃園市大園區北港里工五路七號",NA,NA,NA
7476,"桃園市蘆竹區內厝里南山路二段170號（1樓）",NA,NA,NA
7477,"桃園市蘆竹區內厝里南山路二段六一巷二二號",NA,NA,NA
7478,"桃園市龜山區大華里頂湖九街7號(2樓)",NA,NA,NA
7479,"桃園市蘆竹區坑口里7鄰後壁厝94之5號",NA,NA,NA
7480,"桃園市楊梅區富岡里新明街一○七號",NA,NA,NA
7481,"桃園市龜山區龍壽里東萬壽路六四二巷七八號",NA,NA,NA
7482,"桃園市龍潭區烏林里工五路191巷51號",NA,NA,NA
7483,"桃園市中壢區內定里合定路一○號",NA,NA,NA
7484,"桃園市平鎮區北富里金陵路三段133號",NA,NA,NA
7485,"桃園市蘆竹區瓦窯里南山路一段56巷9號",NA,NA,NA
7486,"桃園市桃園區中德里國際路一段414巷152弄2號1樓",NA,NA,NA
7487,"桃園市平鎮區廣仁里大昌路57巷29號1樓",NA,NA,NA
7488,"桃園市龜山區樂善里文明二街1號",NA,NA,NA
7489,"桃園市龜山區南上里民生北路一段578、580號4樓",NA,NA,NA
7490,"桃園市平鎮區雙連里民族路雙連二段118巷41號2樓",NA,NA,NA
7491,"桃園市八德區大福里力行街５０巷２４號",NA,NA,NA
7492,"桃園市龍潭區烏林里工二路８２巷６號",NA,NA,NA
7493,"桃園市平鎮區中豐路南勢二段四六○巷一一一號",NA,NA,NA
7494,"桃園市八德區瑞興里介壽路二段二五二巷七一弄九五之一號",NA,NA,NA
7495,"桃園市龜山區山頂里山鶯路３２６號",NA,NA,NA
7496,"桃園市大園區北港里１４鄰港仔嘴２之１１號２樓",NA,NA,NA
7497,"桃園市新屋區望間里七鄰十五間尾三之七號",NA,NA,NA
7498,"桃園市中壢區過嶺里福嶺路249號",NA,NA,NA
7499,"桃園市觀音區草漯里成功路一段五０六號",NA,NA,NA
7500,"桃園市平鎮區金陵里金陵路二段八一巷三號一樓",NA,NA,NA
7501,"桃園市桃園區泰山里中山路五０七巷六七號",NA,NA,NA
7502,"桃園市觀音區大潭里7鄰大潭139號",NA,NA,NA
7503,"桃園市楊梅區中山里中山北路一段293巷13號2樓",NA,NA,NA
7504,"桃園市龍潭區三和里新和路299-1號",NA,NA,NA
7505,"桃園市中壢區內定里合定路25-1號2樓",NA,NA,NA
7506,"桃園市蘆竹區錦中里南崁路一段99號4樓之2",NA,NA,NA
7507,"桃園市中壢區內定里合定路２號",NA,NA,NA
7508,"桃園市楊梅區頭湖里楊湖路2段1巷313弄120號2樓",NA,NA,NA
7509,"桃園市觀音區塔腳里4鄰塔子腳63-10號",NA,NA,NA
7510,"桃園市蘆竹區宏竹里１１鄰大竹北路４８１巷２號",NA,NA,NA
7511,"桃園市蘆竹區內厝里南山路二段八六號",NA,NA,NA
7512,"桃園市大溪區瑞源里1鄰番子寮36-67號",NA,NA,NA
7513,"桃園市蘆竹區瓦窯里南山路一段三三一號",NA,NA,NA
7514,"桃園市楊梅區三湖里楊湖路二段六四五號",NA,NA,NA
7515,"桃園市新屋區清華里新華路一段102號",NA,NA,NA
7516,"桃園市大園區內海里中山北路２６３號",NA,NA,NA
7517,"桃園市龜山區南上里南上路二三六號",NA,NA,NA
7518,"桃園市平鎮區湧豐里工業二路6號",NA,NA,NA
7519,"桃園市龜山區樂善里文明一街４號（地下1層、1層、3層）",NA,NA,NA
7520,"桃園市中壢區過嶺里福祥路259巷7號",NA,NA,NA
7521,"桃園市新屋區東明里東勢12之12號",NA,NA,NA
7522,"桃園市八德區白鷺里廣福路八二二號",NA,NA,NA
7523,"桃園市大園區溪海里下溪洲子２１號１樓",NA,NA,NA
7524,"桃園市蘆竹區內厝里長興路三段277巷8號",NA,NA,NA
7525,"桃園市大園區內海里民權路9號3樓",NA,NA,NA
7526,"桃園市蘆竹區海湖里１３鄰海湖１８６之３１號",NA,NA,NA
7527,"桃園市蘆竹區錦興里錦福路三四號",NA,NA,NA
7528,"桃園市平鎮區湧豐里工業五路３－１號１樓",NA,NA,NA
7529,"桃園市蘆竹區新興里大竹路119巷2號2樓",NA,NA,NA
7530,"桃園市蘆竹區新興里十八鄰中興二街二一巷十八號",NA,NA,NA
7531,"桃園市觀音區廣福里１７鄰新坡１９０號１樓",NA,NA,NA
7532,"桃園市觀音區樹林里工業三路５、５之１號",NA,NA,NA
7533,"桃園市平鎮區雙連里民族路雙連２段１１８巷４９弄４９號",NA,NA,NA
7534,"桃園市桃園區大林里大仁路50巷121號",NA,NA,NA
7535,"桃園市大園區橫峰里３０鄰赤牛調３號",NA,NA,NA
7536,"桃園市平鎮區東勢里快速路一段２４６巷１５６號",NA,NA,NA
7537,"桃園市桃園區中德里國際路一段一二０巷三六號",NA,NA,NA
7538,"桃園市龜山區楓樹里長壽路107巷2號5樓",NA,NA,NA
7539,"桃園市龜山區樂善里文化一路75-2號1樓、75-2號2樓、77-1號1樓",NA,NA,NA
7540,"桃園市龍潭區烏林里工一路１５０巷１１０、１１２號",NA,NA,NA
7541,"桃園市桃園區玉山里潮洲街六八、七０號",NA,NA,NA
7542,"桃園市中壢區山東里中正路4鄰四段320號",NA,NA,NA
7543,"桃園市平鎮區新貴里關爺西路84號之1",NA,NA,NA
7544,"桃園市觀音區廣興里埔頂三號",NA,NA,NA
7545,"桃園市蘆竹區錦興里錦秀街6號1樓",NA,NA,NA
7546,"桃園市觀音區富源里新富路215號",NA,NA,NA
7547,"桃園市楊梅區秀才里新江路155巷168號",NA,NA,NA
7548,"桃園市八德區茄苳里永豐路244號",NA,NA,NA
7549,"桃園市觀音區金湖里中山路１段１５６０號",NA,NA,NA
7550,"桃園市龜山區龍壽里10鄰東萬壽路642巷79號",NA,NA,NA
7551,"桃園市蘆竹區長興里長榮路165號",NA,NA,NA
7552,"桃園市中壢區月眉里圓光一路138號",NA,NA,NA
7553,"桃園市平鎮區雙連里雙福路1段65號",NA,NA,NA
7554,"桃園市蘆竹區新興里大竹路267-2號",NA,NA,NA
7555,"桃園市蘆竹區坑口里三德街128號",NA,NA,NA
7556,"桃園市蘆竹區中福里19鄰龍壽街1段2號",NA,NA,NA
7557,"桃園市中壢區吉林路一三號",NA,NA,NA
7558,"桃園市楊梅區中山里四鄰中山北路一段二九三巷六之二號",NA,NA,NA
7559,"桃園市八德區大發里七鄰後庄街六一號",NA,NA,NA
7560,"桃園市龍潭區高平里龍源路30巷12號(4樓)",NA,NA,NA
7561,"桃園市大溪區瑞興里11鄰大鶯路479號",NA,NA,NA
7562,"桃園市大園區五權里中正東路二段513號",NA,NA,NA
7563,"桃園市八德區瑞豐里豐成街35、33號",NA,NA,NA
7564,"桃園市楊梅區水美里楊新路二段五五二號",NA,NA,NA
7565,"桃園市蘆竹區海湖里中圳街１７８號",NA,NA,NA
7566,"桃園市八德區大發里後庄街33巷12號",NA,NA,NA
7567,"桃園市蘆竹區中福里一九鄰龍壽街一段四一巷一一號",NA,NA,NA
7568,"桃園市桃園區汴洲里健行路115號",NA,NA,NA
7569,"桃園市大園區三石里三和路二八巷一三號",NA,NA,NA
7570,"桃園市龜山區嶺頂里振興路四八號",NA,NA,NA
7571,"桃園市龜山區南美里１２鄰南美街１０８號３樓",NA,NA,NA
7572,"桃園市大園區南港里環區西路266巷23號",NA,NA,NA
7573,"桃園市蘆竹區山腳里南山路３段３７３號１樓",NA,NA,NA
7574,"桃園市蘆竹區錦中里錦順街47-5號",NA,NA,NA
7575,"桃園市中壢區文化里長春六路19號(4樓)",NA,NA,NA
7576,"桃園市蘆竹區富竹里一０鄰大竹圍一五一號一樓",NA,NA,NA
7577,"桃園市八德區高城九街31號",NA,NA,NA
7578,"桃園市蘆竹區瓦窯里南山路一段179巷17號",NA,NA,NA
7579,"桃園市蘆竹區長興里南工路１段６號２樓",NA,NA,NA
7580,"桃園市龜山區文化里復興三路350巷66號",NA,NA,NA
7581,"桃園市中壢區內定里文中路2段257巷159號1樓",NA,NA,NA
7582,"桃園市蘆竹區長興里南崁路2段352-3號",NA,NA,NA
7583,"桃園市楊梅區中山里行善路32巷16號",NA,NA,NA
7584,"桃園市蘆竹區瓦窯里3鄰南山路1段121號1樓",NA,NA,NA
7585,"桃園市龜山區大崗里頂湖五街９號４樓",NA,NA,NA
7586,"桃園市大園區田心里國際路一段22號",NA,NA,NA
7587,"桃園市大溪區義和里康莊路三段475、477號",NA,NA,NA
7588,"桃園市蘆竹區內厝里南山路2段205巷22弄5號",NA,NA,NA
7589,"桃園市龜山區南上里南上路五二０巷二八弄二九號一樓",NA,NA,NA
7590,"桃園市大溪區仁武里長興街2段189號",NA,NA,NA
7591,"桃園市蘆竹區長興里厚生路84號3樓之1",NA,NA,NA
7592,"桃園市楊梅區頭湖里楊湖路2段1巷313弄120號（1樓）",NA,NA,NA
7593,"桃園市龜山區大華里頂湖路57號",NA,NA,NA
7594,"桃園市觀音區樹林里經建四路1號(2樓)",NA,NA,NA
7595,"桃園市蘆竹區蘆竹里蘆興街88號",NA,NA,NA
7596,"桃園市平鎮區南勢里5鄰南東路50巷1號1樓",NA,NA,NA
7597,"桃園市八德區高明里高城九街一七號",NA,NA,NA
7598,"桃園市楊梅區梅溪里新農街二段209巷61弄1號",NA,NA,NA
7599,"桃園市蘆竹區海湖里中圳街176號",NA,NA,NA
7600,"桃園市八德區瑞豐里豐成街21號",NA,NA,NA
7601,"桃園市龍潭區烏林里工五路249號(1樓)",NA,NA,NA
7602,"桃園市八德區大湳里和平路411巷166弄1衖10號1樓",NA,NA,NA
7603,"桃園市中壢區文化里長春二路252號1樓",NA,NA,NA
7604,"桃園市蘆竹區長興里南崁路二段66之11號7樓",NA,NA,NA
7605,"桃園市八德區大發里富榮街二七七號",NA,NA,NA
7606,"桃園市蘆竹區山鼻里南山路3段17巷2弄24號2樓",NA,NA,NA
7607,"桃園市大溪區瑞源里石園路二七二號一樓",NA,NA,NA
7608,"桃園市觀音區廣福里新坡一八二號一樓",NA,NA,NA
7609,"桃園市觀音區上大里中觀路1段767號",NA,NA,NA
7610,"桃園市桃園區豐林里南豐街三三九號一樓",NA,NA,NA
7611,"桃園市觀音區草漯里大同一路一二號",NA,NA,NA
7612,"桃園市新屋區頭洲里梅高路三段251號",NA,NA,NA
7613,"桃園市八德區瑞發里興豐路６９１號",NA,NA,NA
7614,"桃園市龍潭區烏林里工五路１９２巷５號",NA,NA,NA
7615,"桃園市大溪區南興里仁和路二段269號",NA,NA,NA
7616,"桃園市觀音區上大里上大90-96號",NA,NA,NA
7617,"桃園市新屋區清華里清華一街72號2樓",NA,NA,NA
7618,"桃園市大溪區永福里10鄰信義路916巷8號",NA,NA,NA
7619,"桃園市觀音區大潭里六鄰快速路9段2250號",NA,NA,NA
7620,"桃園市觀音區樹林里經建一路四九號",NA,NA,NA
7621,"桃園市蘆竹區錦興里南崁路一段231巷23號",NA,NA,NA
7622,"桃園市龍潭區烏林里工五路１３９巷１號及１之１號",NA,NA,NA
7623,"桃園市龜山區新嶺里22鄰宏昇街１８、２０號",NA,NA,NA
7624,"桃園市八德區大榮里大義街六五號",NA,NA,NA
7625,"桃園市桃園區大林里興華路１１號",NA,NA,NA
7626,"桃園市大園區南港里１１鄰許厝港２９之５１號",NA,NA,NA
7627,"桃園市中壢區文化里長春六路17號1樓",NA,NA,NA
7628,"桃園市中壢區忠福里東園二路五之一號",NA,NA,NA
7629,"桃園市新屋區東明里東勢12之10號",NA,NA,NA
7630,"桃園市楊梅區中山里行善路二二巷一○號、中山北路一段廿一巷一號",NA,NA,NA
7631,"桃園市蘆竹區錦興里興隆街４２號",NA,NA,NA
7632,"桃園市中壢區普義里中華路二段三六九號",NA,NA,NA
7633,"桃園市中壢區文化里合江二路3號",NA,NA,NA
7634,"桃園市龜山區文化里華亞三路五０號六樓之一",NA,NA,NA
7635,"桃園市蘆竹區內厝里長興路一段一０七號",NA,NA,NA
7636,"桃園市龜山區大崗里二一鄰頂湖路八巷一號",NA,NA,NA
7637,"桃園市八德區大安里四鄰和平路540巷25號",NA,NA,NA
7638,"桃園市大溪區永福里一三鄰烏塗窟七六之一號",NA,NA,NA
7639,"桃園市大溪區月眉里3鄰信義路460巷18號",NA,NA,NA
7640,"桃園市蘆竹區坑口里南山北路二段202號1樓",NA,NA,NA
7641,"桃園市中壢區龍德里龍興路401巷18之1號1樓",NA,NA,NA
7642,"桃園市新屋區頭洲里七鄰梅高路三段一七一號",NA,NA,NA
7643,"桃園市蘆竹區內厝里南山路2段220號",NA,NA,NA
7644,"桃園市龍潭區中山里東龍路三二四號",NA,NA,NA
7645,"桃園市楊梅區高上里高獅路822巷24號1樓",NA,NA,NA
7646,"桃園市龜山區嶺頂里茶專路１５之１號",NA,NA,NA
7647,"桃園市楊梅區高山里高青路３０之１號１樓",NA,NA,NA
7648,"桃園市蘆竹區內厝里長興路三段39號1樓",NA,NA,NA
7649,"桃園市中壢區復興里自強一路一一之一號",NA,NA,NA
7650,"桃園市龍潭區烏林里工二路八二巷一六號",NA,NA,NA
