"id","Address","Response_Address","Response_X","Response_y"
2554,"桃園市新屋區埔頂里埔頂路2號",NA,NA,NA
2555,"桃園市中壢區中壢工業區高邊路三號",NA,NA,NA
2556,"桃園市中壢區中正里榮民路四二八號",NA,NA,NA
2557,"桃園市楊梅區員本里民隆路３０號",NA,NA,NA
2558,"桃園市龜山區嶺頂里東萬壽路二九九號",NA,NA,NA
2559,"桃園市龜山區南上里民生北路１段５４巷５１號１樓",NA,NA,NA
2560,"桃園市蘆竹區新興里龍安街一段93號",NA,NA,NA
2561,"桃園市龜山區南美里南美街１２６巷１１號",NA,NA,NA
2562,"桃園市中壢區水尾里新生路二段376號",NA,NA,NA
2563,"桃園市蘆竹區新莊里大新路610巷92號",NA,NA,NA
2564,"桃園市新屋區永安里永福路430號、下庄子238之4號",NA,NA,NA
2565,"桃園市蘆竹區海湖里海山中街51-1號1樓",NA,NA,NA
2566,"桃園市楊梅區梅溪里中山北路二段238號1樓",NA,NA,NA
2567,"桃園市平鎮區新貴里中豐路671號(3樓)",NA,NA,NA
2568,"桃園市大園區田心里1鄰大觀路178號",NA,NA,NA
2569,"桃園市龜山區嶺頂里茶專路19、19-1、19-2號",NA,NA,NA
2570,"桃園市中壢區定寧路１５號",NA,NA,NA
2571,"桃園市新屋區頭洲里民族路6段441號1樓",NA,NA,NA
2572,"桃園市大溪區南興里仁和路二段37巷32號.36號",NA,NA,NA
2573,"桃園市八德區大湳里和平路七○四巷一二號",NA,NA,NA
2574,"桃園市新屋區九斗里中山東路２段３０巷４９號",NA,NA,NA
2575,"桃園市蘆竹區內厝里內新路２８號",NA,NA,NA
2576,"桃園市大園區五權里五青路150巷22號",NA,NA,NA
2577,"桃園市蘆竹區坑口里9鄰後壁厝66-6號、南山北路二段1號",NA,NA,NA
2578,"桃園市平鎮區建安里平東路1段178巷6號(1樓)",NA,NA,NA
2579,"桃園市八德區廣興里新興路342巷97號",NA,NA,NA
2580,"桃園市中壢區忠義里自強七路6之1號",NA,NA,NA
2581,"桃園市觀音區富源里六三號",NA,NA,NA
2582,"桃園市觀音區樹林里成功路二段九三五、九三七號",NA,NA,NA
2583,"桃園市新屋區永安里永福路686號",NA,NA,NA
2584,"桃園市桃園區泰山里玉山街２１２巷１４弄１３號",NA,NA,NA
2585,"桃園市中壢區自強一路16號",NA,NA,NA
2586,"桃園市中壢區內厝里中正路三段三一二號",NA,NA,NA
2587,"桃園市楊梅區富岡里13鄰新明街730號(B棟)",NA,NA,NA
2588,"桃園市八德區福興里廣興路三一六巷一四弄三號",NA,NA,NA
2589,"桃園市龜山區文化里華亞二路二二二號",NA,NA,NA
2590,"桃園市龍潭區烏林里工五路62巷27號",NA,NA,NA
2591,"桃園市中壢區復興里自強一路111號",NA,NA,NA
2592,"桃園市龍潭區烏林里工五路139巷116弄43號",NA,NA,NA
2593,"桃園市平鎮區平南里天津街221巷1號",NA,NA,NA
2594,"桃園市大園區南港里6鄰環區西路256號及256之1號",NA,NA,NA
2595,"桃園市龜山區文化里科技七路65號（2樓）",NA,NA,NA
2596,"桃園市楊梅區下窩里民族路五段２０１巷１４６號",NA,NA,NA
2597,"桃園市中壢區水尾里新生路二段四六六號",NA,NA,NA
2598,"桃園市蘆竹區南山路二段470巷24弄7號1樓",NA,NA,NA
2599,"桃園市桃園區建國東路１９號",NA,NA,NA
2600,"桃園市龍潭區烏樹林中豐路420巷54之1號",NA,NA,NA
2601,"桃園市楊梅區高山里高獅路156號",NA,NA,NA
2602,"桃園市楊梅區高山里高青路三九號",NA,NA,NA
2603,"桃園市龍潭區烏林里工二路一段180號(1樓)",NA,NA,NA
2604,"桃園市蘆竹區外社里草仔崎路88號",NA,NA,NA
2605,"桃園市蘆竹區內厝里內溪路32號",NA,NA,NA
2606,"桃園市蘆竹區中福里17鄰龍壽街一段95巷36弄20號",NA,NA,NA
2607,"桃園市龜山區文化里文化二路200號",NA,NA,NA
2608,"桃園市楊梅區水美里民富路1段301號、民富路1段301之1號",NA,NA,NA
2609,"桃園市觀音區樹林里工業二路二二號",NA,NA,NA
2610,"桃園市蘆竹區坑口里和平街36.36之1",NA,NA,NA
2611,"桃園市龜山區山頂里山鶯路338之1（1、2樓）",NA,NA,NA
2612,"桃園市楊梅區高山里青年路6號2樓",NA,NA,NA
2613,"桃園市八德區大發里富榮街二九二號",NA,NA,NA
2614,"桃園市中壢區忠義里中華路一段879巷7號",NA,NA,NA
2615,"桃園市八德區福興里長興路忠孝巷6號",NA,NA,NA
2616,"桃園市平鎮區宋屋里延平路三段六一八號",NA,NA,NA
2617,"桃園市龜山區嶺頂里茶專路6號3樓",NA,NA,NA
2618,"桃園市中壢區永福里中福路二段10巷12號1樓",NA,NA,NA
2619,"桃園市新屋區石磊里7鄰石磊36-7號1樓",NA,NA,NA
2620,"桃園市蘆竹區新莊里大新路八一二號",NA,NA,NA
2621,"桃園市龜山區嶺頂里振興路25-1號",NA,NA,NA
2622,"桃園市楊梅區富豐里新明街525號",NA,NA,NA
2623,"桃園市龜山區大華里頂湖五街9號(1、2樓)",NA,NA,NA
2624,"桃園市八德區大發里後庄街135號、後庄街89號",NA,NA,NA
2625,"桃園市蘆竹區長興里厚生路80號8樓之3",NA,NA,NA
2626,"桃園市龜山區山頂里山鶯路二五二號二樓",NA,NA,NA
2627,"桃園市龍潭區高平里高楊南路３２０巷１３弄３號",NA,NA,NA
2628,"桃園市蘆竹區蘆竹里10鄰富國路二段533號",NA,NA,NA
2629,"桃園市觀音區樹林里經建六路１７號",NA,NA,NA
2630,"桃園市蘆竹區海湖里中圳街186號",NA,NA,NA
2631,"桃園市蘆竹區長興里厚生路５１號６、７、８樓",NA,NA,NA
2632,"桃園市龍潭區烏林里工五路139巷116弄40號",NA,NA,NA
2633,"桃園市新屋區頭洲里快速路六段892號",NA,NA,NA
2634,"桃園市龜山區楓樹里長壽路74、78號",NA,NA,NA
2635,"桃園市龜山區嶺頂里振興路５８巷３弄７號３樓",NA,NA,NA
2636,"桃園市龍潭區烏林里工二路八二巷一四號一樓",NA,NA,NA
2637,"桃園市八德區瑞豐里豐成街55號",NA,NA,NA
2638,"桃園市大溪區義和里康莊路３段６９０、６９２、６９４、６９４之１號",NA,NA,NA
2639,"桃園市蘆竹區長興里長興路三段229巷59號1.2.3樓",NA,NA,NA
2640,"桃園市平鎮區高雙里長安路601號1樓",NA,NA,NA
2641,"桃園市蘆竹區長興里南崁路二段228巷266弄35號",NA,NA,NA
2642,"桃園市平鎮區平鎮工業區工業十一路七號",NA,NA,NA
2643,"桃園市蘆竹區新興里中興一街６１巷６號",NA,NA,NA
2644,"桃園市桃園區汴洲里鹽庫街65巷16、18號1樓",NA,NA,NA
2645,"桃園市蘆竹區新興里中興二街四六號一、二、三樓",NA,NA,NA
2646,"桃園市觀音區樹林里一五鄰國建三路九號",NA,NA,NA
2647,"桃園市八德區永豐里華康街245號1樓、2樓",NA,NA,NA
2648,"桃園市中壢區復興里自強二路二號",NA,NA,NA
2649,"桃園市蘆竹區錦興里錦福路３２號",NA,NA,NA
2650,"桃園市中壢區過嶺里福祥路289巷7號",NA,NA,NA
2651,"桃園市蘆竹區長興里南崁路二段228巷277弄9號",NA,NA,NA
2652,"桃園市龍潭區烏林里工二路一段198號",NA,NA,NA
2653,"桃園市楊梅區頭湖里楊湖路二段1巷313弄120號",NA,NA,NA
2654,"桃園市中壢區水尾里新生路７８０號",NA,NA,NA
2655,"桃園市楊梅區高山里高青路一○巷五號",NA,NA,NA
2656,"桃園市蘆竹區海湖里海山路二段一四九號",NA,NA,NA
2657,"桃園市觀音區成功路二段九四三號",NA,NA,NA
2658,"桃園市大園區竹圍里航翔路５號８樓之９",NA,NA,NA
2659,"桃園市八德區廣德里新興路121號",NA,NA,NA
2660,"桃園市中壢區內定里高邊路5號1樓",NA,NA,NA
2661,"桃園市八德區高明里高城路一四一號一樓",NA,NA,NA
2662,"桃園市楊梅區上田里梅高路二段431巷131弄12號",NA,NA,NA
2663,"桃園市龜山區萬壽路1段490號7樓之2、492號7樓之2、492之1號7樓之1及7樓之2",NA,NA,NA
2664,"桃園市平鎮區工業十路１５之２號",NA,NA,NA
2665,"桃園市蘆竹區長興里南崁路228巷268號",NA,NA,NA
2666,"桃園市龜山區樂善里１５鄰文明路２８號",NA,NA,NA
2667,"桃園市龜山區南上里民生北路一段三三三號",NA,NA,NA
2668,"桃園市楊梅區高山里獅二路3號1樓",NA,NA,NA
2669,"桃園市觀音區工業三路７號",NA,NA,NA
2670,"桃園市桃園區玉山里玉山街150號",NA,NA,NA
2671,"桃園市蘆竹區內厝里內溪路62號3樓",NA,NA,NA
2672,"桃園市平鎮區建安里金陵路四段475-12號（2樓）",NA,NA,NA
2673,"桃園市新屋區永安里永福路770之1號（1樓）",NA,NA,NA
2674,"桃園市楊梅區高山里高青路２８巷１之１號１、２樓",NA,NA,NA
2675,"桃園市中壢區內定里內定二十街15巷12號",NA,NA,NA
2676,"桃園市龜山區南上里民生北路一段574號7樓",NA,NA,NA
2677,"桃園市八德區竹園里3鄰新興路1188號1樓",NA,NA,NA
2678,"桃園市龍潭區九龍里九座寮４３之２３號",NA,NA,NA
2679,"桃園市龍潭區凌雲里聖亭路２０７號",NA,NA,NA
2680,"桃園市觀音區崙坪里忠愛路123巷9弄16之1號1樓",NA,NA,NA
2681,"桃園市楊梅區上湖里中山南路800巷190號",NA,NA,NA
2682,"桃園市龜山區大華里頂湖七街６號",NA,NA,NA
2683,"桃園市桃園區中信里德華街111號",NA,NA,NA
2684,"桃園市蘆竹區內厝里內溪路四九號",NA,NA,NA
2685,"桃園市蘆竹區新莊里1鄰大興路20巷21弄9號",NA,NA,NA
2686,"桃園市蘆竹區內厝里內溪路53號",NA,NA,NA
2687,"桃園市龜山區大崗里頂湖路５９號１樓",NA,NA,NA
2688,"桃園市中壢區內定里合圳北路二段473巷27-6號1樓",NA,NA,NA
2689,"桃園市觀音區草漯里大同二路１２－１號",NA,NA,NA
2690,"桃園市龍潭區高平里高楊南路238巷69號（1樓）",NA,NA,NA
2691,"桃園市龜山區龍壽里龍校街一二一巷六弄二一號",NA,NA,NA
2692,"桃園市桃園區龍山里龍壽街81巷12弄11號1、2樓",NA,NA,NA
2693,"桃園市中壢區松柏路八號",NA,NA,NA
2694,"桃園市蘆竹區瓦窯里南山路一段二七四、二七六號",NA,NA,NA
2695,"桃園市中壢區工業區新北園路一六號",NA,NA,NA
2696,"桃園市龍潭區三和里新和路255號",NA,NA,NA
2697,"桃園市觀音區經建四路三○號",NA,NA,NA
2698,"桃園市中壢區中壢工業區東園路３號",NA,NA,NA
2699,"桃園市龜山區大華里２２鄰頂湖一街６號",NA,NA,NA
2700,"桃園市龜山區大崗里頂湖一街１２號",NA,NA,NA
2701,"桃園市觀音區崙坪里1鄰崙坪1-52號",NA,NA,NA
2702,"桃園市八德區茄苳里永豐路二七六巷一四號",NA,NA,NA
2703,"桃園市蘆竹區長興里南崁路二段228巷273弄5號",NA,NA,NA
2704,"桃園市桃園區大林里大明街57巷15號(1樓)",NA,NA,NA
2705,"桃園市楊梅區高山里青年路５之２號１樓",NA,NA,NA
2706,"桃園市楊梅區瑞原里民有路一段二０二號",NA,NA,NA
2707,"桃園市蘆竹區內厝里長興路3段227號2樓",NA,NA,NA
2708,"桃園市平鎮區建安里太平東路1-21號3樓",NA,NA,NA
2709,"桃園市蘆竹區海湖里二一鄰海湖東路三七五號",NA,NA,NA
2710,"桃園市蘆竹區山腳里海山路八九號",NA,NA,NA
2711,"桃園市觀音區樹林里經建四路一五號",NA,NA,NA
2712,"桃園市觀音區藍埔里青埔二四之一○號",NA,NA,NA
2713,"桃園市觀音區新坡里張厝137-2號(1.2樓)",NA,NA,NA
2714,"桃園市八德區白鷺里廣福路879巷172、174號",NA,NA,NA
2715,"桃園市蘆竹區瓦窯里南山路一段349巷18號1樓",NA,NA,NA
2716,"桃園市新屋區石磊里七鄰石磊三六之二０號",NA,NA,NA
2717,"桃園市龍潭區烏林里工二路298巷80弄26之15號、26之17號",NA,NA,NA
2718,"桃園市中壢區普忠里普忠路231巷18號",NA,NA,NA
2719,"桃園市中壢區三民里中正路1274巷32號(1樓)",NA,NA,NA
2720,"桃園市中壢區忠福里東園路38之2號1樓",NA,NA,NA
2721,"桃園市楊梅區上田里高平路205巷11號",NA,NA,NA
2722,"桃園市觀音區保障里九鄰草漯五一之一０號",NA,NA,NA
2723,"桃園市龜山區大崗里頂湖十一街十二號",NA,NA,NA
2724,"桃園市蘆竹區內厝里內新路2巷3號",NA,NA,NA
2725,"桃園市楊梅區高榮里高榮路239巷190之3號",NA,NA,NA
2726,"桃園市龜山區南上里民生北路一段38-1號3樓",NA,NA,NA
2727,"桃園市八德區大興里榮興路533巷60號1樓 ",NA,NA,NA
2728,"桃園市蘆竹區新興里中興路55巷12號",NA,NA,NA
2729,"桃園市大園區內海里民生路123-13號",NA,NA,NA
2730,"桃園市龜山區南上里民生北路1段50之13、50之15、50之16號",NA,NA,NA
2731,"桃園市龍潭區武漢里武中路669號（1樓）",NA,NA,NA
2732,"桃園市楊梅區高山里廿三鄰高青路二八巷一號",NA,NA,NA
2733,"桃園市楊梅區梅溪里1鄰新農街二段209巷89號",NA,NA,NA
2734,"桃園市大園區內海里下厝路187號1樓",NA,NA,NA
2735,"桃園市蘆竹區新興里中興路53號(2樓)",NA,NA,NA
2736,"桃園市觀音區經建四路38號",NA,NA,NA
2737,"桃園市蘆竹區內厝里南山路２段３７號",NA,NA,NA
2738,"桃園市大溪區月眉里3鄰信義路502號",NA,NA,NA
2739,"桃園市龜山區山頂里山鶯路國光巷三號",NA,NA,NA
2740,"桃園市平鎮區新貴里中豐路６２９號",NA,NA,NA
2741,"桃園市觀音區大潭里塘尾一二之一二號",NA,NA,NA
2742,"桃園市平鎮區雙連里民族路雙連二段一一八巷五三弄一０號",NA,NA,NA
2743,"桃園市龜山區山頂里山鶯路文華巷２號",NA,NA,NA
2744,"桃園市中壢區內厝里中正路三段220巷85弄20號1樓",NA,NA,NA
2745,"桃園市龜山區山頂里山鶯路156-2號(1-5樓).156-3號(2-5樓)",NA,NA,NA
2746,"桃園市蘆竹區新興里中興一街140號1樓",NA,NA,NA
2747,"桃園市蘆竹區內厝里大豐街10號、油管路1段432號",NA,NA,NA
2748,"桃園市龜山區大坑里南上路３５０巷４８號",NA,NA,NA
2749,"桃園市龜山區大華里頂湖路9號1樓、9-3號1-3樓",NA,NA,NA
2750,"桃園市大園區田心里崁腳38-2號",NA,NA,NA
2751,"桃園市龜山區南上里民生北路1段282號",NA,NA,NA
2752,"桃園市蘆竹區內厝里內溪路68巷47號（1樓）",NA,NA,NA
2753,"桃園市蘆竹區長興里南崁路二段228巷266弄17號",NA,NA,NA
2754,"桃園市龍潭區九龍里中興路九龍段129巷169號",NA,NA,NA
2755,"桃園市觀音區經建五路六號",NA,NA,NA
2756,"桃園市蘆竹區坑口里三德街四二號",NA,NA,NA
2757,"桃園市大園區南港里許厝港二九之二０號",NA,NA,NA
2758,"桃園市蘆竹區錦中里南崁路１段２０７之２號",NA,NA,NA
2759,"桃園市蘆竹區內厝里大豐街４３巷４號１樓",NA,NA,NA
2760,"桃園市觀音區觀音工業區成功路一段504號",NA,NA,NA
2761,"桃園市中壢區過嶺里福達路二段322巷6號",NA,NA,NA
2762,"桃園市觀音區白玉里一之三號",NA,NA,NA
2763,"桃園市蘆竹區海湖里中圳街17巷17號",NA,NA,NA
2764,"桃園市楊梅區高山里青年路二段301巷170號",NA,NA,NA
2765,"桃園市龜山區龍華里萬壽路一段492-19號5樓之2及492-20號5樓之1、之2",NA,NA,NA
2766,"桃園市楊梅區永平里梅獅路一段439巷16號",NA,NA,NA
2767,"桃園市中壢區合圳南路７之１及９號",NA,NA,NA
2768,"桃園市龍潭區三和里１鄰華映路１號",NA,NA,NA
2769,"桃園市蘆竹區新興里中興一街四六號",NA,NA,NA
2770,"桃園市龜山區大崗里頂湖路五○號",NA,NA,NA
2771,"桃園市八德區大安里榮興路７３巷３２號",NA,NA,NA
2772,"桃園市中壢區內定里合定路1號",NA,NA,NA
2773,"桃園市八德區大仁里和平路1441巷22弄4衖6號",NA,NA,NA
2774,"桃園市龍潭區高平里１１鄰高楊南路２３８巷７９號",NA,NA,NA
2775,"桃園市中壢區月眉里中正路三段316巷82號1樓",NA,NA,NA
2776,"桃園市中壢區長春六路20號",NA,NA,NA
2777,"桃園市龜山區山頂里興業街13號(1樓)",NA,NA,NA
2778,"桃園市八德區福興里17鄰長興路忠孝巷32號",NA,NA,NA
2779,"桃園市桃園區泰山里潮洲街54號",NA,NA,NA
2780,"桃園市蘆竹區新興里大竹路269巷1弄23號1樓",NA,NA,NA
2781,"桃園市平鎮區建安里金陵路四段477巷8號1樓",NA,NA,NA
2782,"桃園市中壢區內定里合江路20號",NA,NA,NA
2783,"桃園市龜山區南上里民生北路一段166巷1號1樓及地下一樓",NA,NA,NA
2784,"桃園市平鎮區東勢里快速路一段２２６巷１９號",NA,NA,NA
2785,"桃園市桃園區龍山里龍壽街一八七號",NA,NA,NA
2786,"桃園市大園區北港里工五路六號",NA,NA,NA
2787,"桃園市龜山區嶺頂里振興路一七號",NA,NA,NA
2788,"桃園市新屋區清華里中山東路一段五二巷八號",NA,NA,NA
2789,"桃園市龜山區南上里南上路386巷15號1樓",NA,NA,NA
2790,"桃園市龍潭區烏林里工五路210巷22號",NA,NA,NA
2791,"桃園市楊梅區上田里和平路236巷30弄16號",NA,NA,NA
2792,"桃園市觀音區觀音工業區成功路一段五０七號",NA,NA,NA
2793,"桃園市龜山區兔坑里海萍路六巷七號",NA,NA,NA
2794,"桃園市觀音區草漯里源遠街八、七之一號",NA,NA,NA
2795,"桃園市桃園區玉山里漢中路139號",NA,NA,NA
2796,"桃園市蘆竹區瓦窯里南山路一段349巷16號1樓",NA,NA,NA
2797,"桃園市蘆竹區長興里興隆街29號",NA,NA,NA
2798,"桃園市八德區永豐里永豐路385號",NA,NA,NA
2799,"桃園市桃園區大林里大原路一六巷三○弄五號",NA,NA,NA
2800,"桃園市龍潭區烏林里工二路一段178號",NA,NA,NA
2801,"桃園市蘆竹區內厝里南山路2段243號1樓",NA,NA,NA
2802,"桃園市新屋區頭洲里高鐵南路六段45巷23號",NA,NA,NA
2803,"桃園市龜山區樂善里文明三街三之一號一樓",NA,NA,NA
2804,"桃園市龍潭區烏林里工五路191巷10號",NA,NA,NA
2805,"桃園市蘆竹區中福里龍壽街一段261巷3號1樓",NA,NA,NA
2806,"桃園市觀音區中觀路一段116號1樓",NA,NA,NA
2807,"桃園市龜山區大坑里南上路５２６號１樓",NA,NA,NA
2808,"桃園市蘆竹區坑口里後壁厝95之5號",NA,NA,NA
2809,"桃園市觀音區樹林里工業五路７號",NA,NA,NA
2810,"桃園市平鎮區湧光里工業七路8號1樓",NA,NA,NA
2811,"桃園市中壢區復華里自強四路7號1樓",NA,NA,NA
2812,"桃園市楊梅區高山里獅五路２、２－１號",NA,NA,NA
2813,"桃園市中壢區山東里山東路157巷58號",NA,NA,NA
2814,"桃園市龜山區龍壽里萬壽路一段一四七六之二號一樓",NA,NA,NA
2815,"桃園市龜山區龍華里萬壽路1段551巷6號",NA,NA,NA
2816,"桃園市新屋區頭洲里青田路413號",NA,NA,NA
2817,"桃園市桃園區玉山里德壽四街6號",NA,NA,NA
2818,"桃園市龜山區嶺頂里萬壽路二段三四七巷一、三號",NA,NA,NA
2819,"桃園市中壢區永福里東園二路9號",NA,NA,NA
2820,"桃園市龜山區福源里湖山街180巷77弄61號1樓、61-2號、61-6號",NA,NA,NA
2821,"桃園市八德區大發里後庄街68號1樓",NA,NA,NA
2822,"桃園市蘆竹區長興里厚生路76號5樓之1",NA,NA,NA
2823,"桃園市新屋區下田里下田心子22-50號",NA,NA,NA
2824,"桃園市楊梅區瑞原里民富路一段七九六巷一００號",NA,NA,NA
2825,"桃園市中壢區過嶺里福祥路346巷11號",NA,NA,NA
2826,"桃園市龜山區龍華里萬壽路一段四九０號八樓之一",NA,NA,NA
2827,"桃園市龜山區南上里民生北路一段540號6樓",NA,NA,NA
2828,"桃園市楊梅區高山里高青路二八巷七號",NA,NA,NA
2829,"桃園市八德區大發里富榮街八號",NA,NA,NA
2830,"桃園市龜山區兔坑里茶專一街60巷19弄17號",NA,NA,NA
2831,"桃園市八德區興仁里長興路302號",NA,NA,NA
2832,"桃園市楊梅區新榮里快速路五段1120號、桃園市楊梅區新榮里新榮路369號",NA,NA,NA
2833,"桃園市中壢區中正里興仁路二段488巷6號（1樓）",NA,NA,NA
2834,"桃園市桃園區中德里桃德路八九巷二一號",NA,NA,NA
2835,"桃園市楊梅區富豐里富豐南路109巷112號",NA,NA,NA
2836,"桃園市龍潭區黃唐里成功路12號",NA,NA,NA
2837,"桃園市大溪區員林里員林路2段336巷11號1樓",NA,NA,NA
2838,"桃園市龜山區大華里頂湖路5-9號",NA,NA,NA
2839,"桃園市蘆竹區南興里蘆興南路623巷10號",NA,NA,NA
2840,"桃園市新屋區九斗里上青埔58之3號",NA,NA,NA
2841,"桃園市大園區內海里中山北路二八０巷七號",NA,NA,NA
2842,"桃園市觀音區觀音工業區經建四路七之一號",NA,NA,NA
2843,"桃園市中壢區三民里中正路１２７４巷３８號",NA,NA,NA
2844,"桃園市龜山區龍壽里龍校街121巷6巷23號",NA,NA,NA
2845,"桃園市新屋區望間里8鄰十五間尾13-6號1樓",NA,NA,NA
2846,"桃園市楊梅區大同里行善路６６號",NA,NA,NA
2847,"桃園市觀音區草漯里大同一路一號",NA,NA,NA
2848,"桃園市蘆竹區新興里文中路一段19巷21之1號",NA,NA,NA
2849,"桃園市蘆竹區長興里長榮路１７１、１７１之１號",NA,NA,NA
2850,"桃園市新屋區清華里中山東路一段156巷26號",NA,NA,NA
2851,"桃園市八德區大安里榮興路７３巷２４號３樓",NA,NA,NA
2852,"桃園市大園區大海里8鄰大牛稠21-49號",NA,NA,NA
2853,"桃園市中壢區永福里中福路二段10巷15-1號",NA,NA,NA
2854,"桃園市楊梅區青山里獅三路5號1樓",NA,NA,NA
2855,"桃園市觀音區富源里新富路183號",NA,NA,NA
2856,"桃園市楊梅區高上里高青路12號",NA,NA,NA
2857,"桃園市楊梅區高山里高獅路822巷30號1樓",NA,NA,NA
2858,"桃園市蘆竹區新興里中興二街19號",NA,NA,NA
2859,"桃園市龍潭區高平里高楊南路17號",NA,NA,NA
2860,"桃園市桃園區汴洲里春日路一五二八巷二二號",NA,NA,NA
2861,"桃園市龜山區大華里頂湖五街12巷8號(1樓)",NA,NA,NA
2862,"桃園市龜山區南上里民生北路一段二巷四弄一號",NA,NA,NA
2863,"桃園市桃園區玉山里玉山街１７６號２樓",NA,NA,NA
2864,"桃園市龍潭區烏林里工五路210巷14號1樓",NA,NA,NA
2865,"桃園市八德區大發里後庄街九七號",NA,NA,NA
2866,"桃園市桃園區建國里建明街三○號",NA,NA,NA
2867,"桃園市楊梅區秀才里新江路１５５巷６９、７１號",NA,NA,NA
2868,"桃園市楊梅區瑞塘里福羚路一○○號",NA,NA,NA
2869,"桃園市八德區瑞發里介壽路二段七二六號",NA,NA,NA
2870,"桃園市平鎮區廣仁里大昌路55巷18號3樓",NA,NA,NA
2871,"桃園市中壢區自強一路５號",NA,NA,NA
2872,"桃園市蘆竹區新興里大竹路121號2樓",NA,NA,NA
2873,"桃園市楊梅區中山里環東路289號1、2、3樓",NA,NA,NA
2874,"桃園市龍潭區聖德里聖德街82號",NA,NA,NA
2875,"桃園市蘆竹區中福里龍安街二段二一一號",NA,NA,NA
2876,"桃園市大溪區仁善里介壽路二六三號",NA,NA,NA
2877,"桃園市平鎮區北興里金陵路二段三五六號",NA,NA,NA
2878,"桃園市龜山區舊路里3鄰東舊路街58號",NA,NA,NA
2879,"桃園市八德區茄苳里永興街３４號",NA,NA,NA
2880,"桃園市中壢區芝芭里民權路3段1326號",NA,NA,NA
2881,"桃園市平鎮區平南里中豐路南勢２段４６０巷１０２、１０２－１號",NA,NA,NA
2882,"桃園市楊梅區仁美里永平路57號",NA,NA,NA
2883,"桃園市桃園區中信里中山路１０００號１３樓之２",NA,NA,NA
2884,"桃園市蘆竹區內厝里內新路５３號",NA,NA,NA
2885,"桃園市大溪區仁和里仁和九街１１８號１樓",NA,NA,NA
2886,"桃園市楊梅區幼獅工業區幼四路三號",NA,NA,NA
2887,"桃園市桃園區西埔里永安路一三二六號",NA,NA,NA
2888,"桃園市楊梅區高上里高獅路677號",NA,NA,NA
2889,"桃園市中壢區忠福里東園路五號",NA,NA,NA
2890,"桃園市平鎮區平鎮工業區工業二路１０號",NA,NA,NA
2891,"桃園市桃園區泰山里玉山街一六○巷二號",NA,NA,NA
2892,"桃園市楊梅區瑞塘里梅獅路二段六一六巷六號",NA,NA,NA
2893,"桃園市蘆竹區錦興里南崁路二段二○一巷七號一樓",NA,NA,NA
2894,"桃園市楊梅區瑞原里民富路１段７９６巷２９號",NA,NA,NA
2895,"桃園市新屋區清華里中山東路一段五二巷五二號一樓",NA,NA,NA
2896,"桃園市桃園區龍岡里龍壽街二一○之一二號",NA,NA,NA
2897,"桃園市大園區北港里工六路七號",NA,NA,NA
2898,"桃園市龜山區龍壽里東萬壽路六三一號",NA,NA,NA
2899,"桃園市龜山區龜山里大同路三四二號",NA,NA,NA
2900,"桃園市平鎮區東勢里金陵路七段一四八號",NA,NA,NA
2901,"桃園市平鎮區湧光里工業十二路五號",NA,NA,NA
2902,"桃園市蘆竹區內厝里南山路二段四九九號",NA,NA,NA
2903,"桃園市楊梅區埔心幼獅工業區幼二路四號",NA,NA,NA
2904,"桃園市桃園區龍岡里龍壽街２７３巷２７號",NA,NA,NA
2905,"桃園市蘆竹區內厝里南山路２段２０５巷４９號及６８號",NA,NA,NA
2906,"桃園市龜山區文化里科技一路29號2樓",NA,NA,NA
2907,"桃園市蘆竹區海湖里中圳街１９號",NA,NA,NA
2908,"桃園市八德區廣興里力霸街五八號",NA,NA,NA
2909,"桃園市龜山區大同里大同路二六八號",NA,NA,NA
2910,"桃園市龜山區大崗里頂湖二街六六巷二號",NA,NA,NA
2911,"桃園市楊梅區幼獅工業區幼四路四號",NA,NA,NA
2912,"桃園市蘆竹區中福里中興八號",NA,NA,NA
2913,"桃園市中壢區忠義里中華路一段八七九巷九號",NA,NA,NA
2914,"桃園市蘆竹區南崁里新南路一段三○五巷五弄一號",NA,NA,NA
2915,"桃園市八德區大安里長安街２９號",NA,NA,NA
2916,"桃園市蘆竹區內厝里長興路三段219巷3號",NA,NA,NA
2917,"桃園市中壢區普仁里中山東路二段一六六號",NA,NA,NA
2918,"桃園市蘆竹區錦興里南崁路一段三○五號",NA,NA,NA
2919,"桃園市大園區五權里中正東路三段245巷110弄19號",NA,NA,NA
2920,"桃園市中壢區成功里大華路一四號一樓",NA,NA,NA
2921,"桃園市觀音區大同里下大堀九０之一號",NA,NA,NA
2922,"桃園市蘆竹區蘆竹里富國路三段１４１０巷１７之４號５樓",NA,NA,NA
2923,"桃園市楊梅區高山里高獅路158號",NA,NA,NA
2924,"桃園市觀音區樹林里經建二路五二號",NA,NA,NA
2925,"桃園市觀音區經建五路二號",NA,NA,NA
2926,"桃園市龜山區龍壽里東萬壽路642巷111號",NA,NA,NA
2927,"桃園市桃園區慈文里慈華街二二號一樓",NA,NA,NA
