"id","Address","Response_Address","Response_X","Response_y"
5101,"桃園市平鎮區平南里漢口街121巷5號（1樓）",NA,NA,NA
5102,"桃園市蘆竹區海湖里２１鄰海湖東路３７９號",NA,NA,NA
5103,"桃園市蘆竹區海湖里九鄰一八六之六號",NA,NA,NA
5104,"桃園市蘆竹區新興里中興路73號",NA,NA,NA
5105,"桃園市楊梅區高榮里13鄰高榮路841號及榮平路323號",NA,NA,NA
5106,"桃園市八德區瑞豐里友聯街51巷24號1樓",NA,NA,NA
5107,"桃園市平鎮區建安里五鄰平東路六七九巷三號",NA,NA,NA
5108,"桃園市觀音區富林里工業七路９號",NA,NA,NA
5109,"桃園市蘆竹區長興里厚生路84號4樓之1",NA,NA,NA
5110,"桃園市蘆竹區內厝里南山路二段一○○巷四號",NA,NA,NA
5111,"桃園市楊梅區瑞坪里梅獅路二段616巷1-1號",NA,NA,NA
5112,"桃園市桃園區汴洲里春日路1651巷12弄9號1樓",NA,NA,NA
5113,"桃園市楊梅區梅溪里新農街二段209巷53號1、2樓",NA,NA,NA
5114,"桃園市楊梅區秀才里新江路155巷77、79號",NA,NA,NA
5115,"桃園市蘆竹區內厝里南山路２段３９４巷６１弄６號１樓",NA,NA,NA
5116,"桃園市觀音區榮工南路１３號",NA,NA,NA
5117,"桃園市楊梅區員本里民隆路33號",NA,NA,NA
5118,"桃園市觀音區觀音工業區大同二路一六號",NA,NA,NA
5119,"桃園市楊梅區永平里新農街二段209巷118號2樓",NA,NA,NA
5120,"桃園市龍潭區烏林里工五路88號1樓",NA,NA,NA
5121,"桃園市八德區廣隆里廣福路770巷38號2樓",NA,NA,NA
5122,"桃園市楊梅區高山里高獅路863巷15號",NA,NA,NA
5123,"桃園市八德區瑞豐里友聯街二九巷八號",NA,NA,NA
5124,"桃園市蘆竹區錦興里錦華路52號1樓",NA,NA,NA
5125,"桃園市楊梅區豐野里中正路547-1號",NA,NA,NA
5126,"桃園市大溪區員林里員林路2段336巷31、33號1樓",NA,NA,NA
5127,"桃園市大園區五權里五青路63巷491弄89號",NA,NA,NA
5128,"桃園市龍潭區烏林里工五路74巷11號(1樓)",NA,NA,NA
5129,"桃園市蘆竹區內厝里長興路一段119號",NA,NA,NA
5130,"桃園市新屋區頭洲里青田路四一一號",NA,NA,NA
5131,"桃園市八德區廣興里廣興路一三六○巷八一號",NA,NA,NA
5132,"桃園市桃園區龍山里龍壽街81巷12弄2號",NA,NA,NA
5133,"桃園市中壢區山東里山大路836號1樓",NA,NA,NA
5134,"桃園市大園區五權里合圳北路三段453號1樓",NA,NA,NA
5135,"桃園市楊梅區高山里高青路２２巷１６號",NA,NA,NA
5136,"桃園市觀音區樹林里經建六路23號",NA,NA,NA
5137,"桃園市蘆竹區坑口里頭前七之六號",NA,NA,NA
5138,"桃園市蘆竹區內厝里長安路二段120巷8弄12號",NA,NA,NA
5139,"桃園市楊梅區秀才里秀才路618號",NA,NA,NA
5140,"桃園市蘆竹區新興里中興二街11號1樓",NA,NA,NA
5141,"桃園市蘆竹區錦興里南崁下四一之一○號",NA,NA,NA
5142,"桃園市蘆竹區海湖里海湖184號",NA,NA,NA
5143,"桃園市龜山區楓樹里自強北路17巷31號1樓",NA,NA,NA
5144,"桃園市蘆竹區新興里新興街273巷53號",NA,NA,NA
5145,"桃園市觀音區工業一路七號",NA,NA,NA
5146,"桃園市桃園區豐林里介壽路22號",NA,NA,NA
5147,"桃園市龜山區迴龍里湖山街一八０巷八弄三號",NA,NA,NA
5148,"桃園市楊梅區太平里永平路５３９號",NA,NA,NA
5149,"桃園市楊梅區中山里環東路二六二號",NA,NA,NA
5150,"桃園市觀音區草漯里13鄰成功路一段408號",NA,NA,NA
5151,"桃園市蘆竹區內厝里南崁內溪路六二號",NA,NA,NA
5152,"桃園市蘆竹區中福里龍壽街一段95巷2弄14-4號",NA,NA,NA
5153,"桃園市新屋區清華里清華二街79號",NA,NA,NA
5154,"桃園市蘆竹區長興里厚生路6號",NA,NA,NA
5155,"桃園市平鎮區鎮興里陸橋南路155號",NA,NA,NA
5156,"桃園市中壢區自強一路１２號１樓",NA,NA,NA
5157,"桃園市桃園區汴洲里春日路1492之1、之2、之3號5樓",NA,NA,NA
5158,"桃園市桃園區大林里興邦路３９之９號",NA,NA,NA
5159,"桃園市龜山區龍壽里萬壽路一段549號1樓",NA,NA,NA
5160,"桃園市中壢區南園二路8之2號",NA,NA,NA
5161,"桃園市蘆竹區長興里南崁路２段６６號４樓之６",NA,NA,NA
5162,"桃園市中壢區過嶺里福祥路597號",NA,NA,NA
5163,"桃園市中壢區東園路三五號",NA,NA,NA
5164,"桃園市新屋區後湖里中山西路一段119號",NA,NA,NA
5165,"桃園市蘆竹區坑口里大有街二九號",NA,NA,NA
5166,"桃園市龍潭區烏林里工五路七四巷二號",NA,NA,NA
5167,"桃園市觀音區工業八路二號",NA,NA,NA
5168,"桃園市新屋區清華里中華路８１０之１號",NA,NA,NA
5169,"桃園市觀音區樹林里經建一路３３號",NA,NA,NA
5170,"桃園市平鎮區工業一路１４之９號１樓",NA,NA,NA
5171,"桃園市平鎮區湧豐里工業二路2-6號",NA,NA,NA
5172,"桃園市中壢區內定里高邊路５號",NA,NA,NA
5173,"桃園市中壢區永福里7鄰南園路10號",NA,NA,NA
5174,"桃園市中壢區三民里中正路１２７４巷５９號",NA,NA,NA
5175,"桃園市中壢區文化里安東路3巷8號",NA,NA,NA
5176,"桃園市龜山區兔坑里茶專一街74號",NA,NA,NA
5177,"桃園市龜山區兔坑里五鄰大丘田二一之一號",NA,NA,NA
5178,"桃園市平鎮區北貴里關爺東路37巷10號(1樓)",NA,NA,NA
5179,"桃園市蘆竹區蘆竹里富國路3段1200號4樓",NA,NA,NA
5180,"桃園市桃園區南門里南山街156號6樓",NA,NA,NA
5181,"桃園市大園區橫峰里中正東路一０三號",NA,NA,NA
5182,"桃園市楊梅區三湖里中山南路八○○巷六六號",NA,NA,NA
5183,"桃園市中壢區內厝里聖德路１段２８１號",NA,NA,NA
5184,"桃園市龜山區兔坑里茶專路67-1號",NA,NA,NA
5185,"桃園市平鎮區建安里平東路659巷111號1樓",NA,NA,NA
5186,"桃園市龜山區樂善里文明三街5之1號(2樓)",NA,NA,NA
5187,"桃園市蘆竹區蘆竹里南崁路二段419巷22弄11號1樓",NA,NA,NA
5188,"桃園市觀音區草漯里大同二路19號",NA,NA,NA
5189,"桃園市大園區北港里大工路１９號",NA,NA,NA
5190,"桃園市中壢區至善里後興路一段一三九、一四一號",NA,NA,NA
5191,"桃園市龜山區南上里民生北路１段５０號",NA,NA,NA
5192,"桃園市平鎮區南勢里南東路８號１樓",NA,NA,NA
5193,"桃園市中壢區內定里內定二十街15巷10號",NA,NA,NA
5194,"桃園市大園區內海里民族路12號",NA,NA,NA
5195,"桃園市楊梅區高山里高獅路740巷6之1號",NA,NA,NA
5196,"桃園市大園區溪海里一五鄰吳厝二五號",NA,NA,NA
5197,"桃園市八德區永豐里永豐路416巷16號1樓",NA,NA,NA
5198,"桃園市桃園區龍山里龍壽街218號",NA,NA,NA
5199,"桃園市觀音區金湖里中山路一段一一七一巷二０號",NA,NA,NA
5200,"桃園市中壢區內厝里4鄰內厝子35-1號",NA,NA,NA
5201,"桃園市觀音區草漯里一六鄰成功路一段五一一號",NA,NA,NA
5202,"桃園市蘆竹區海湖里海山中街七一號",NA,NA,NA
5203,"桃園市八德區白鷺里廣福路８７９巷９８－６號",NA,NA,NA
5204,"桃園市大園區五權里五青路１３２號",NA,NA,NA
5205,"桃園市蘆竹區長興里溪洲四０之一二號",NA,NA,NA
5206,"桃園市八德區廣興里廣福路503號（一樓、一樓夾層、二樓）",NA,NA,NA
5207,"桃園市蘆竹區山鼻里南山路二段512號(1樓)",NA,NA,NA
5208,"桃園市蘆竹區內厝里油管路一段430號",NA,NA,NA
5209,"桃園市八德區白鷺里永豐路82巷10弄18號1樓",NA,NA,NA
5210,"桃園市龜山區大坑里南上路386巷8號",NA,NA,NA
5211,"桃園市蘆竹區內厝里長安路二段108號(1樓)",NA,NA,NA
5212,"桃園市楊梅區高山里高青路１０巷７號",NA,NA,NA
5213,"桃園市蘆竹區長興里7鄰南崁路2段228巷168號",NA,NA,NA
5214,"桃園市龜山區龍壽里萬壽路一段五五一號",NA,NA,NA
5215,"桃園市龍潭區烏林里工五路138號",NA,NA,NA
5216,"桃園市八德區廣興里廣興路一四三三號",NA,NA,NA
5217,"桃園市龜山區大坑里南上路388號",NA,NA,NA
5218,"桃園市蘆竹區蘆竹里蘆竹街１４３號",NA,NA,NA
5219,"桃園市蘆竹區五福里五福一路３２巷１５號",NA,NA,NA
5220,"桃園市龍潭區北興里中興路18巷115、117號",NA,NA,NA
5221,"桃園市桃園區南門里南豐二街80號",NA,NA,NA
5222,"桃園市八德區茄苳里寶豐街一五巷四號",NA,NA,NA
5223,"桃園市中壢區水尾里培英路七六號",NA,NA,NA
5224,"桃園市中壢區中正里榮民路447號1樓",NA,NA,NA
5225,"桃園市中壢區內定里內定二十街１５８巷４８號２樓",NA,NA,NA
5226,"桃園市八德區茄苳里茄苳路７６０巷１０號",NA,NA,NA
5227,"桃園市桃園區玉山里玉山街二一四號",NA,NA,NA
5228,"桃園市蘆竹區山腳里１６鄰橋頭街166號",NA,NA,NA
5229,"桃園市大園區北港里工四路１３號",NA,NA,NA
5230,"桃園市觀音區崙坪里忠愛路二段198-225號",NA,NA,NA
5231,"桃園市龍潭區烏林里工五路１９２巷１號",NA,NA,NA
5232,"桃園市新屋區下田里五鄰員笨二八之一號",NA,NA,NA
5233,"桃園市觀音區工業一路１６之１號",NA,NA,NA
5234,"桃園市蘆竹區蘆竹里蘆興街100巷1弄7之1號1樓",NA,NA,NA
5235,"桃園市大園區內海里民權路八之一號",NA,NA,NA
5236,"桃園市八德區福興里廣興路188號",NA,NA,NA
5237,"桃園市蘆竹區瓦窯里南山路一段220號(1樓)",NA,NA,NA
5238,"桃園市龜山區大華里頂湖十一街３號",NA,NA,NA
5239,"桃園市八德區福興里廣興路316巷2號",NA,NA,NA
5240,"桃園市平鎮區北貴里關爺東路37巷2號2樓",NA,NA,NA
5241,"桃園市中壢區普義里普義路二○六號",NA,NA,NA
5242,"桃園市楊梅區員本里民富路三段248-1號",NA,NA,NA
5243,"桃園市大園區埔心里11鄰中正東路1段840巷99號（2樓）",NA,NA,NA
5244,"桃園市楊梅區瑞原里民富路二段40號",NA,NA,NA
5245,"桃園市楊梅區豐野里中正路549巷2之1及2之2號",NA,NA,NA
5246,"桃園市龍潭區高原里高原路367巷163弄9號",NA,NA,NA
5247,"桃園市中壢區永福里西園路１３６、１３６之２號",NA,NA,NA
5248,"桃園市蘆竹區錦中里錦順街四七之七號一樓",NA,NA,NA
5249,"桃園市中壢區忠福里東園路一一號",NA,NA,NA
5250,"桃園市龍潭區高平里１１鄰高楊南路２３８巷１２５弄２２、２４號",NA,NA,NA
5251,"桃園市桃園區大林里興華路８號、８之２號",NA,NA,NA
5252,"桃園市楊梅區上田里高平路205巷50號",NA,NA,NA
5253,"桃園市桃園區泰山里玉山街192號",NA,NA,NA
5254,"桃園市楊梅區三湖里1鄰楊湖路一段756號",NA,NA,NA
5255,"桃園市桃園區大林里大明街五六巷六、八號",NA,NA,NA
5256,"桃園市蘆竹區山腳里南山北路一段100巷10號",NA,NA,NA
5257,"桃園市八德區茄苳里聯明街9號",NA,NA,NA
5258,"桃園市八德區大安里長安街306號3樓",NA,NA,NA
5259,"桃園市蘆竹區長興里南崁路２段３５２之２號１樓、３５２之３號１樓",NA,NA,NA
5260,"桃園市觀音區金湖里中山路一段一一七一巷一六弄二一號",NA,NA,NA
5261,"桃園市龜山區龍壽里龍校街一二一巷六弄五號",NA,NA,NA
5262,"桃園市龜山區龍壽里萬壽路一段551巷1弄18號1樓",NA,NA,NA
5263,"桃園市龍潭區黃唐里中興路四六六巷三九號一樓",NA,NA,NA
5264,"桃園市中壢區文化里６鄰安東路５號",NA,NA,NA
5265,"桃園市平鎮區雙連里民族路雙連二段一一八巷五三弄三０號",NA,NA,NA
5266,"桃園市中壢區永福里北園路23號1樓",NA,NA,NA
5267,"桃園市蘆竹區中福里17鄰福興31-13號",NA,NA,NA
5268,"桃園市八德區大安里榮興路六五號",NA,NA,NA
5269,"桃園市龍潭區烏林里工五路１９１巷６７弄６７號",NA,NA,NA
5270,"桃園市楊梅區高山里高青路二二巷一七號",NA,NA,NA
5271,"桃園市平鎮區東勢里快速路1段222號",NA,NA,NA
5272,"桃園市蘆竹區蘆竹里蘆竹街１４７號",NA,NA,NA
5273,"桃園市觀音區保障里九鄰六八之一號",NA,NA,NA
5274,"桃園市觀音區崙坪里一二鄰崙坪一九五之二二、二三號",NA,NA,NA
5275,"桃園市楊梅區高上里幼二路3號",NA,NA,NA
5276,"桃園市八德區大發里和平路704巷19號",NA,NA,NA
5277,"桃園市蘆竹區瓦窯里南山路一段126巷23號1樓",NA,NA,NA
5278,"桃園市中壢區文化里２１鄰長春二路２５６號",NA,NA,NA
5279,"桃園市桃園區汴洲里鹽庫西街八五之一號一樓",NA,NA,NA
5280,"桃園市桃園區汴洲里經國路888號十樓之8.之9.之10",NA,NA,NA
5281,"桃園市龜山區南上里南上路290巷21弄7號",NA,NA,NA
5282,"桃園市蘆竹區內厝里南山路二段１００巷１０號",NA,NA,NA
5283,"桃園市龜山區山頂里興邦路３３之２、３３之５號",NA,NA,NA
5284,"桃園市楊梅區高山里幼三路１號",NA,NA,NA
5285,"桃園市中壢區內厝里24鄰大圳路三段151號",NA,NA,NA
5286,"桃園市中壢區普義里普義路五四號一樓",NA,NA,NA
5287,"桃園市中壢區龍德里龍興路４１５巷１３號１樓",NA,NA,NA
5288,"桃園市蘆竹區長興里長興路四段71巷63弄10號（1樓）",NA,NA,NA
5289,"桃園市觀音區上大里忠富路上大段489號",NA,NA,NA
5290,"桃園市平鎮區宋屋里新光路二段九巷六一號一樓",NA,NA,NA
5291,"桃園市新屋區埔頂里埔頂45之6號",NA,NA,NA
5292,"桃園市楊梅區豐林里梅獅路２段５７８巷１６弄２０號",NA,NA,NA
5293,"桃園市蘆竹區新莊里大新路814巷66號",NA,NA,NA
5294,"桃園市八德區竹園里長興路七二九號",NA,NA,NA
5295,"桃園市龜山區福源里十四鄰湖山街三００號",NA,NA,NA
5296,"桃園市平鎮區建安里金陵路四段475-9號",NA,NA,NA
5297,"桃園市蘆竹區坑口里三德街五四巷五號",NA,NA,NA
5298,"桃園市龍潭區三林里中正路三林段一九０號一樓",NA,NA,NA
5299,"桃園市蘆竹區新興里龍安街一段103號1樓",NA,NA,NA
5300,"桃園市觀音區樹林里工業五路１１號",NA,NA,NA
5301,"桃園市觀音區樹林里成功路2段913號、工業六路1號",NA,NA,NA
5302,"桃園市觀音區富源里富源11-1號",NA,NA,NA
5303,"桃園市龜山區嶺頂里萬壽路二段257之1號",NA,NA,NA
5304,"桃園市蘆竹區長興里南崁路二段二六五號",NA,NA,NA
5305,"桃園市楊梅區高榮里高上路一段302號",NA,NA,NA
5306,"桃園市大園區田心里國際路一段195號",NA,NA,NA
5307,"桃園市龜山區嶺頂里萬壽路二段四一○巷一二號",NA,NA,NA
5308,"桃園市龍潭區烏林里３９鄰工二路２９８巷７９號",NA,NA,NA
5309,"桃園市桃園區大林里大誠路二號",NA,NA,NA
5310,"桃園市龜山區南上里民生北路1段256巷6弄1號（1樓）",NA,NA,NA
5311,"桃園市龜山區南上里民生北路一段166巷1號2樓",NA,NA,NA
5312,"桃園市平鎮區南東路50巷29號（4樓）",NA,NA,NA
5313,"桃園市中壢區內定里一鄰高下路5號",NA,NA,NA
5314,"桃園市八德區茄苳里永豐路250號",NA,NA,NA
5315,"桃園市蘆竹區內厝里長安路一段163號",NA,NA,NA
5316,"桃園市中壢區復華里中華路一段568號（登記使用3、4、5、10樓）",NA,NA,NA
5317,"桃園市蘆竹區錦興里南崁路一段二三一巷一七號",NA,NA,NA
5318,"桃園市大園區北港里工四路五號",NA,NA,NA
5319,"桃園市八德區茄苳里開隆街三○號二樓",NA,NA,NA
5320,"桃園市中壢區自強一路16之2號",NA,NA,NA
5321,"桃園市蘆竹區長興里南崁路二段四二巷六號一樓及八號",NA,NA,NA
5322,"桃園市新屋區永安里永福路625號",NA,NA,NA
5323,"桃園市蘆竹區新莊里大興路20巷21弄6-1號（3樓）",NA,NA,NA
5324,"桃園市桃園區汴洲里?庫西街四四號",NA,NA,NA
5325,"桃園市龜山區嶺頂里萬壽路一段1699號、國園街15號",NA,NA,NA
5326,"桃園市楊梅區高山里高青路二二巷一一號",NA,NA,NA
5327,"桃園市龍潭區烏林里工二路一段200號(1樓)",NA,NA,NA
5328,"桃園市龍潭區九龍里中興路九龍段129巷175弄7號",NA,NA,NA
5329,"桃園市新屋區永安里12鄰永福路380號",NA,NA,NA
5330,"桃園市平鎮區雙連里民族路雙連二段一一八巷五一弄三四號",NA,NA,NA
5331,"桃園市龜山區大崗里頂湖二街七○號",NA,NA,NA
5332,"桃園市楊梅區豐野里中正路377巷25號",NA,NA,NA
5333,"桃園市新屋區清華里中山東路一段201號1樓",NA,NA,NA
5334,"桃園市平鎮區建安里平東路一段178巷26弄12號",NA,NA,NA
5335,"桃園市大園區內海里中山北路２６３之３號",NA,NA,NA
5336,"桃園市蘆竹區長興里南崁路二段228巷266弄26號",NA,NA,NA
5337,"桃園市龜山區南上里民生北路一段五八０號五樓",NA,NA,NA
5338,"桃園市觀音區大堀里新華路二段225之2、225之3、225之5號",NA,NA,NA
5339,"桃園市蘆竹區長興里長興路四段227巷22號（1樓）",NA,NA,NA
5340,"桃園市桃園區泰山里泰山街六六號一樓",NA,NA,NA
5341,"桃園市蘆竹區內厝里南山路2段5巷12號1、2、3樓",NA,NA,NA
5342,"桃園市觀音區金湖里中山路一段1560號（1樓）",NA,NA,NA
5343,"桃園市中壢區文化里吉林路２０號",NA,NA,NA
5344,"桃園市龍潭區高平里龍源路３０巷３９號",NA,NA,NA
5345,"桃園市桃園區中德里桃德路39巷38號",NA,NA,NA
5346,"桃園市龜山區文化里華亞二路１９號１樓",NA,NA,NA
5347,"桃園市蘆竹區錦興里錦秀街10號",NA,NA,NA
5348,"桃園市新屋區下埔里七鄰後湖三二之一號",NA,NA,NA
5349,"桃園市龍潭區聖德里湧光路一段169巷75-1號",NA,NA,NA
5350,"桃園市龍潭區烏林里工二路七十巷二一弄五號",NA,NA,NA
5351,"桃園市龍潭區烏林里工一路１５０巷３８號",NA,NA,NA
5352,"桃園市桃園區中泰里中山路939、939-1號",NA,NA,NA
5353,"桃園市蘆竹區海湖里16鄰186-2號",NA,NA,NA
5354,"桃園市八德區瑞發里民權街２３號",NA,NA,NA
5355,"桃園市龍潭區烏林里工五路139巷116弄17號",NA,NA,NA
5356,"桃園市蘆竹區大竹里大竹路二八八號",NA,NA,NA
5357,"桃園市蘆竹區中興里大福路230號",NA,NA,NA
5358,"桃園市中壢區內定里合圳北路二段475號1.2.3樓",NA,NA,NA
5359,"桃園市蘆竹區新莊里大興路20巷2號",NA,NA,NA
5360,"桃園市八德區白鷺里廣福路1182巷65號",NA,NA,NA
5361,"桃園市八德區瑞豐里建國路772巷160弄28號1樓",NA,NA,NA
5362,"桃園市桃園區大林里大仁路50巷76號",NA,NA,NA
5363,"桃園市蘆竹區長興里南崁路二段二七０號",NA,NA,NA
5364,"桃園市中壢區過嶺里1鄰民族路五段36號",NA,NA,NA
5365,"桃園市觀音區大潭里1鄰環科路326號",NA,NA,NA
5366,"桃園市觀音區樹林里經建四路2-23號",NA,NA,NA
5367,"桃園市平鎮區北興里關爺北路四三號",NA,NA,NA
5368,"桃園市平鎮區新安里洪圳路２０７之１號及２０５號",NA,NA,NA
5369,"桃園市中壢區中壢工業區自強一路三七號",NA,NA,NA
5370,"桃園市蘆竹區內厝里內溪路六八巷二號",NA,NA,NA
5371,"桃園市桃園區豐林里三民路三段362號",NA,NA,NA
5372,"桃園市蘆竹區內厝里內溪路５３之３號",NA,NA,NA
5373,"桃園市桃園區泰山里玉山街146巷9號1樓",NA,NA,NA
5374,"桃園市中壢區內厝里福全路197號",NA,NA,NA
5375,"桃園市八德區茄苳里開隆街１２號１樓",NA,NA,NA
5376,"桃園市蘆竹區南崁里南崁路一段二三一巷一二號",NA,NA,NA
5377,"桃園市蘆竹區長興里長興路四段二七三巷一二號",NA,NA,NA
5378,"桃園市龍潭區烏林里工二路298巷52號",NA,NA,NA
5379,"桃園市八德區瑞興里介壽路二段252巷71弄74號",NA,NA,NA
5380,"桃園市楊梅區高上里青年路5號",NA,NA,NA
5381,"桃園市龜山區南美里南上路３５０巷５５號",NA,NA,NA
5382,"桃園市龜山區山頂里興業街2號3樓",NA,NA,NA
5383,"桃園市觀音區工業一路一四號",NA,NA,NA
5384,"桃園市楊梅區青山里獅ㄧ路10-1號",NA,NA,NA
5385,"桃園市平鎮區鎮興里興隆路二七號",NA,NA,NA
5386,"桃園市龍潭區中山里中豐路三號",NA,NA,NA
5387,"桃園市中壢區中福里吉林路9號",NA,NA,NA
5388,"桃園市觀音區經建五路30號",NA,NA,NA
5389,"桃園市八德區茄苳里永豐路二五三號",NA,NA,NA
5390,"桃園市桃園區大林里興華路23號（含興華路18號、21巷1號、大智路2號）",NA,NA,NA
5391,"桃園市龜山區文化里復興三路５００號１、２、５、６、８樓",NA,NA,NA
5392,"桃園市龜山區南美里南上路290巷32號",NA,NA,NA
5393,"桃園市蘆竹區蘆竹里富國路二段一七號",NA,NA,NA
5394,"桃園市觀音區樹林里經建一路46巷2號",NA,NA,NA
5395,"桃園市八德區廣德里新興路113號（3樓）",NA,NA,NA
5396,"桃園市觀音區白玉里玉林路１段７４７號１樓",NA,NA,NA
5397,"桃園市龍潭區烏林里工五路２３３號１樓",NA,NA,NA
5398,"桃園市桃園區中埔里永安路一○六三號",NA,NA,NA
5399,"桃園市桃園區西埔里富國路八五九號",NA,NA,NA
5400,"桃園市八德區茄苳里寶豐街15巷2弄14號1樓",NA,NA,NA
5401,"桃園市桃園區大林里興華路6號1樓及3樓",NA,NA,NA
5402,"桃園市龜山區龍華里萬壽路一段492-5號6樓之1",NA,NA,NA
5403,"桃園市龜山區大同里大同路400號",NA,NA,NA
5404,"桃園市楊梅區富岡里富聯路三五六巷八號",NA,NA,NA
5405,"桃園市楊梅區上田里和平路188號",NA,NA,NA
5406,"桃園市大溪區員林里員林路2段340號",NA,NA,NA
5407,"桃園市蘆竹區南崁里建新街二四號",NA,NA,NA
5408,"桃園市大園區內海里中山北路２７５號",NA,NA,NA
5409,"桃園市中壢區內定里內定二十街31巷11號1、3、4樓",NA,NA,NA
5410,"桃園市蘆竹區瓦窯里南山路一段179巷21號",NA,NA,NA
5411,"桃園市龜山區文化里華亞一路22、26號及復興三路350巷68號",NA,NA,NA
5412,"桃園市觀音區樹林里國建三路七之二號",NA,NA,NA
5413,"桃園市龍潭區烏林里工五路227號2樓",NA,NA,NA
5414,"桃園市龜山區大華里頂湖路15號1樓",NA,NA,NA
5415,"桃園市龜山區龍華里萬壽路一段四九二之一號六樓之二",NA,NA,NA
5416,"桃園市新屋區清華里清華二街62號1樓",NA,NA,NA
5417,"桃園市中壢區過嶺里福達路二段３２２巷２號",NA,NA,NA
5418,"桃園市楊梅區豐野里二六鄰中正路六三二巷七號",NA,NA,NA
5419,"桃園市蘆竹區內厝里長興路３段２１９巷３號",NA,NA,NA
5420,"桃園市蘆竹區內厝里南山路二段三九四巷二之一號",NA,NA,NA
5421,"桃園市楊梅區瑞原里民富路一段796巷25之1號",NA,NA,NA
5422,"桃園市八德區永豐里永豐路416巷13號",NA,NA,NA
5423,"桃園市龍潭區高平里中豐路高平段22號",NA,NA,NA
5424,"桃園市中壢區東園路一二號",NA,NA,NA
5425,"桃園市大園區北港里工四路一五號",NA,NA,NA
5426,"桃園市蘆竹區內厝里大豐街四一號",NA,NA,NA
5427,"桃園市觀音區樹林里15鄰經建四路2號",NA,NA,NA
5428,"桃園市龍潭區烏林里工五路２２６號２樓",NA,NA,NA
5429,"桃園市觀音區草漯里大同二路四二號",NA,NA,NA
5430,"桃園市八德區大宏里桃德路141巷26號",NA,NA,NA
5431,"桃園市新屋區永安里12鄰永福路756號",NA,NA,NA
5432,"桃園市中壢區內定里定安路一三號",NA,NA,NA
5433,"桃園市新屋區清華里清華一街122號",NA,NA,NA
5434,"桃園市觀音區樹林里國建三路7號",NA,NA,NA
5435,"桃園市蘆竹區內厝里大豐街25號",NA,NA,NA
5436,"桃園市桃園區中平里吉昌街４６巷１２號１樓",NA,NA,NA
5437,"桃園市龜山區文化里頂湖一街67巷5號",NA,NA,NA
5438,"桃園市八德區廣隆里20鄰廣隆街191巷13號",NA,NA,NA
5439,"桃園市中壢區過嶺里民族路六段642巷11號",NA,NA,NA
5440,"桃園市大園區埔心里中正東路一段840巷79號",NA,NA,NA
5441,"桃園市八德區大福里力行街50巷9弄12號",NA,NA,NA
5442,"桃園市龜山區舊路里振興路749巷1弄16號",NA,NA,NA
5443,"桃園市蘆竹區坑口里大有街三號",NA,NA,NA
5444,"桃園市中壢區復興里北園路19號",NA,NA,NA
5445,"桃園市八德區高明里高城路215號1樓",NA,NA,NA
5446,"桃園市中壢區三民里中正路１２７４巷４６號",NA,NA,NA
5447,"桃園市龜山區大坑里6鄰南上路663巷90號",NA,NA,NA
5448,"桃園市龜山區大坑里南上路520巷6弄22號",NA,NA,NA
5449,"桃園市龜山區龍壽里萬壽路一段五五一巷五號一樓",NA,NA,NA
5450,"桃園市蘆竹區海湖里海湖北路275號1樓、277號1樓",NA,NA,NA
5451,"桃園市龜山區山頂里山鶯路165號",NA,NA,NA
5452,"桃園市蘆竹區瓦窯里南山路１段９９號",NA,NA,NA
5453,"桃園市蘆竹區長興里南崁路二段66之5號",NA,NA,NA
5454,"桃園市觀音區武威里仁愛路一段４２５號",NA,NA,NA
5455,"桃園市楊梅區高上里高獅路703號",NA,NA,NA
5456,"桃園市蘆竹區長興里南工路一段八之二號",NA,NA,NA
5457,"桃園市龜山區福源里湖山街180巷110號",NA,NA,NA
5458,"桃園市蘆竹區錦興里錦福路24號（1樓及夾層）",NA,NA,NA
5459,"桃園市楊梅區高上里高獅路935號",NA,NA,NA
5460,"桃園市龜山區樂善里文化一路75-2號(6樓)",NA,NA,NA
5461,"桃園市蘆竹區內厝里長興路三段二二九巷五八號",NA,NA,NA
5462,"桃園市中壢區忠福里南園二路8號（1樓）",NA,NA,NA
5463,"桃園市龜山區龍壽里萬壽路一段五三一巷四號",NA,NA,NA
5464,"桃園市觀音區觀音工業區工業四路一六號",NA,NA,NA
5465,"桃園市楊梅區高山里高獅路八一三巷二六弄九號",NA,NA,NA
5466,"桃園市大園區埔心里中正東路一段840巷97號",NA,NA,NA
5467,"桃園市大溪區仁愛里八鄰二號",NA,NA,NA
5468,"桃園市龜山區龍壽里萬壽路一段四三○巷七號",NA,NA,NA
5469,"桃園市蘆竹區內厝里南山路二段二０五巷二二弄七之一號",NA,NA,NA
5470,"桃園市中壢區內厝里大圳路三段51巷58號",NA,NA,NA
5471,"桃園市大溪區一德里康莊路五九一號",NA,NA,NA
5472,"桃園市龜山區樂善里文明三街六號",NA,NA,NA
5473,"桃園市中壢區內定里松江北路７號",NA,NA,NA
