"id","Address","Response_Address","Response_X","Response_y"
751,"桃園市觀音區成功路1段520號",NA,NA,NA
752,"桃園市觀音區草漯里榮工南路十二號",NA,NA,NA
753,"桃園市蘆竹區新興里中興一街五五及五七號",NA,NA,NA
754,"桃園市八德區大明里福德一路50號1樓",NA,NA,NA
755,"桃園市蘆竹區內厝里南山路２段２０５巷２２弄１７號",NA,NA,NA
756,"桃園市大園區?林里三民路二段８３１號１樓",NA,NA,NA
757,"桃園市蘆竹區中福里龍壽街一段69號之2",NA,NA,NA
758,"桃園市龜山區大崗里頂湖路９２號",NA,NA,NA
759,"桃園市大園區竹圍里航翔路5號7樓之9",NA,NA,NA
760,"桃園市中壢區中壢工業區北園路11號",NA,NA,NA
761,"桃園市中壢區內定里定寧路8-2號",NA,NA,NA
762,"桃園市觀音區崙坪里忠愛路二段198-270號",NA,NA,NA
763,"桃園市楊梅區大平里中山南路567號",NA,NA,NA
764,"桃園市大園區北港里大工路一三二號",NA,NA,NA
765,"桃園市平鎮區新安里洪圳路一七六號一樓",NA,NA,NA
766,"桃園市蘆竹區南崁里南崁路2段66之8號3樓",NA,NA,NA
767,"桃園市龍潭區高平里中豐路高平段18號、18號2樓、18號3樓",NA,NA,NA
768,"桃園市蘆竹區內厝里南山路二段112號1樓",NA,NA,NA
769,"桃園市楊梅區上田里和平路一四三號",NA,NA,NA
770,"桃園市蘆竹區海湖里一三鄰海湖一八六之三三號",NA,NA,NA
771,"桃園市新屋區頭洲里８鄰快速路６段６３８號",NA,NA,NA
772,"桃園市蘆竹區內厝里長興路三段二二九巷三四、三六號",NA,NA,NA
773,"桃園市龜山區兔坑里海萍路六巷三號及六巷五弄一、二號",NA,NA,NA
774,"桃園市楊梅區瑞原里民富路二段199巷15號",NA,NA,NA
775,"桃園市觀音區樹林村工業六路二號",NA,NA,NA
776,"桃園市桃園區汴洲里春日路一六五一巷四六號",NA,NA,NA
777,"桃園市中壢區內定里內定七街320號",NA,NA,NA
778,"桃園市中壢區永光里民權路三段３３４巷４６號３樓",NA,NA,NA
779,"桃園市桃園區大林里21鄰大誠路8之6號及興邦路38號",NA,NA,NA
780,"桃園市楊梅區中山里環東路二七一號一樓",NA,NA,NA
781,"桃園市八德區瑞豐里友聯街51巷2號（1樓）",NA,NA,NA
